--,Decision,Exclusion reason,Paper code,Paper number,Screening set,Extraction set,Paper,Publication year,Title,DOI,Species latin,Family,Class,Phylum,Sex exposed,Fertilisation mode,Agricultural importance,Lab or field,Animal origin,Stressor variation,Habitat,Country of origin,Continent of origin,Ocean/sea of origin,Exposure duration,Life-stage of animal,Lowest temp below 10°C?,Constant or fluctuating?,Acclimated?,Temperature,Humidity,pH,Salinity,Radiation,Number of stressors,Interaction effects?,Other stressors,Gamete traits,Gonad traits,Reproductive output,Mating behaviour,Survival,Comments,Number of projects,#SURVIVAL,#AQUATIC,#WILD,#SPERM,#COLD,#INTERACTION,...52
Fay Frost,Include,NA,TEMP1809,1574,30,C,"Sales, K.et al.",2018,Experimental heatwaves compromise sperm function and cause transgenerational damage in a model insect,10.1038/s41467-018-07273-z,Tribolium castaneum,Tenebrionidae,Insecta,Arthropoda,Both sexes,Internal,Pest,Lab,Lab-reared,Experimental,Terrestrial,NA,NA,NA,1 to 5 days,Adult,No,Constant,No,Yes,No,No,No,No,1,NA,No,"Sperm count, activity and mobility",NA,"Fecundity, Paternity",NA,Yes,NA,2,Yes,No,No,Yes,No,No,NA
Fay Frost,Include,NA,TEMP1810,1575,30,C,"Sales, K.et al.",2021,Fertility and mortality impacts of thermal stress from experimental heatwaves on different life stages and their recovery in a model insect,10.1098/rsos.201717,Tribolium castaneum,Tenebrionidae,Insecta,Arthropoda,Both sexes,Internal,Pest,Lab,Lab-reared,Experimental,Terrestrial,NA,NA,NA,1 to 5 days,Mix,No,Constant,No,Yes,No,No,No,No,1,NA,No,"Sperm count, sperm acitivity",Testes size,Offspring production,NA,Yes,NA,2,Yes,No,No,Yes,No,No,NA
Claire Smithson,Exclude,About temperature stress on rice,TEMP1811,1576,30,21B,"SALIM, M.; SAXENA, R. m. d.",1991,TEMPERATURE STRESS AND VARIETAL RESISTANCE IN RICE - EFFECTS ON WHITEBACKED PLANTHOPPER,10.2135/cropsci1991.0011183X003100060048x,Sogatella furcifera,Delphacidae,Insecta,Arthropoda,Both sexes,Internal,Pest,Lab,Wild-caught,Experimental,Terrestrial,Japan,Asia,NA,More than 5 days,Adult,No,Fluctuating,No,Yes,No,No,No,No,1,NA,No,NA,NA,Fecundity,NA,Yes,NA,1,Yes,No,No,No,No,No,NA
Rhonda Snook,Include,NA,TEMP1814,1579,30,14B,"Sambucetti, P.et al.",2015,Patterns of longevity and fecundity at two temperatures in a set of heat-selected recombinant inbred lines of Drosophila melanogaster,10.1007/s10522-015-9606-8,Drosophila melanogaster,Drosophilidae,Insecta,Arthropoda,Both sexes,Internal,No,Lab,Lab-reared,Experimental,Terrestrial,NA,NA,NA,1 to 5 days,Adult,No,Constant,Yes (multiple generations),Yes,No,No,No,No,1,NA,No,NA,NA,Fecundity,NA,Yes,Experimental evolution,1,Yes,No,No,No,No,No,NA
Rhonda Snook,Include,NA,TEMP1818,1581,30,14A,"Sanchez, J. A.; Lacasa, A.",2002,Modelling population dynamics of Orius laevigatus and O-albidipennis (Hemiptera : Anthocoridae) to optimize their use as biological control agents of Frankliniella occidentalis (Thysanoptera : Thripidae),10.1079/BER2001136,"Orius laevigatus, Orius arbidipennis",Anthocoridae,Insecta,Arthropoda,Both sexes,Internal,Control agent,Lab,Lab-reared,Experimental,Terrestrial,NA,NA,NA,More than 5 days,Mix,No,Constant,No,Yes,No,No,No,No,1,NA,No,NA,NA,Fecundity,NA,Yes,NA,1,Yes,No,No,No,No,No,NA
Rhonda Snook,Include,NA,TEMP1819,1582,30,14A,"Sanchez, J. A.et al.",2009,"Life history parameters for Nesidiocoris tenuis (Reuter) (Het., Miridae) under different temperature regimes",10.1111/j.1439-0418.2008.01342.x,Nesidiocoris tenuis,Miridae,Insecta,Arthropoda,Both sexes,Internal,Mix,Lab,Wild-caught,Experimental,Terrestrial,Spain,Europe,NA,Mix,Mix,No,Constant,No,Yes,No,No,No,No,1,NA,No,NA,NA,Fecundity,NA,Yes,NA,1,Yes,No,No,No,No,No,NA
Rhonda Snook,Exclude,No sample size,TEMP1821,1584,30,14A,"SANDS, D.et al.",1991,"EFFECTS OF TEMPERATURE ON DEVELOPMENT AND SEASONALITY OF EUDOCIMA-SALAMINIA (LEPIDOPTERA, NOCTUIDAE) IN EASTERN AUSTRALIA",10.1017/S0007485300033563,Eudocima salaminia,Erebidae,Insecta,Arthropoda,Both sexes,Internal,Pest,Lab,Wild-caught,Experimental,Terrestrial,Australia,Australasia,NA,More than 5 days,Adult,No,Constant,No,Yes,No,No,No,No,1,NA,No,NA,NA,Fecundity,Percentage of mates adults,Yes,NA,1,Yes,No,No,No,No,No,NA
Rhonda Snook,Include,NA,TEMP1823,1586,30,14B,"Sanpradit, P.et al.",2020,Temperature and concentration of ZnO particles affect life history traits and oxidative stress in Daphnia magna,10.1016/j.aquatox.2020.105517,Daphnia magna,Daphniidae,Crustacea,Arthropoda,Parthenogenetic,Internal,No,Lab,Lab-reared,Experimental,Terrestrial,NA,NA,NA,More than 5 days,Adult,No,Constant,No,Yes,No,No,No,No,1,NA,ZnO concentration,NA,NA,"Number of eggs, number of juveniles",NA,Yes,NA,1,Yes,No,No,No,No,No,NA
Rhonda Snook,Exclude,No temp/fecundity data,TEMP1834,1596,30,14A,"Sasmita, H. I.et al.",2019,"Effects of larval diets and temperature regimes on life history traits, energy reserves and temperature tolerance of male Aedes aegypti (Diptera: Culicidae): optimizing rearing techniques for the sterile insect programmes",10.1186/s13071-019-3830-z,Aedes aegypti,Culicidae,Insecta,Arthropoda,Both sexes,Internal,Other,Lab,Lab-reared,Experimental,Both,NA,NA,NA,1 to 5 days,Mix,No,Constant,No,Yes,No,No,No,No,1,NA,Diet,NA,NA,"Female fertilisation success, amount of sperm in spermatheca",NA,Yes,NA,1,Yes,No,No,No,No,No,NA
Rhonda Snook,Include,NA,TEMP1835,1597,30,14B,"Satar, G.et al.",2019,"Some Demographic Parameters of Lysiphlebus confusus, L. fabarum, and L. testaceipes (Hymenoptera: Braconidae: Aphidiinae)",10.1093/jee/toz041,"Lysiphlebus confusus, Lysiphlebus fabarum, Lysiphlebus testaceipes",Braconidae,Insecta,Arthropoda,Both sexes,Internal,Control agent,Lab,Lab-reared,Experimental,Terrestrial,NA,NA,NA,More than 5 days,Mix,No,Constant,No,Yes,No,No,No,No,1,NA,No,NA,NA,"Number of eggs per female, lifetime number of eggs",NA,Yes,Intrinsic population growth rate provided,1,Yes,No,No,No,No,No,NA
Rhonda Snook,Exclude,Survival curve,TEMP1836,1598,30,14B,"Satar, S.et al.",2005,Effect of temperature on development and fecundity of Aphis gossypii Glover (Homoptera : Aphididae) on cucumber,10.1007/s10340-005-0082-9,Aphis gossypii,Aphididae,Insecta,Arthropoda,Parthenogenetic,Internal,Pest,Lab,Lab-reared,Experimental,Terrestrial,NA,NA,NA,More than 5 days,Adult,No,Constant,No,Yes,No,No,No,No,1,NA,No,NA,NA,Nymph number,NA,Yes,population growth rate provided,1,Yes,No,No,No,No,No,NA
Rhonda Snook,Exclude,No sample size,TEMP1837,1599,30,14A,Satishchandra al.,2018,"Effect of Temperature and CO2 on Population Growth of South American Tomato Moth, Tuta absoluta (Meyrick) (Lepidoptera: Gelechiidae) on Tomato",10.1093/jee/toy143,Tuta absoluta,Gelechiidae,Insecta,Arthropoda,Both sexes,Internal,Pest,Lab,Wild-caught,Experimental,Terrestrial,India,Asia,NA,More than 5 days,Mix,No,Constant,No,Yes,No,No,No,No,1,NA,CO2,NA,NA,Fecundity,NA,Yes,"Mulitple stressor with CO2, population growth rate",1,Yes,No,No,No,No,No,NA
Rhonda Snook,Exclude,No useable data,TEMP1840,1602,31,14B,"Saussure et al, 2019",2019,"Effect of three isolates of Pandora neoaphidis from a single population of Sitobion avenae on mortality, speed of kill and fecundity of S. avenae and Rhopalosiphum padi at different temperatures",10.1016/j.funeco.2019.03.004,"Sitobion avenae, Rhopalosiphum padi",Aphididae,Insecta,Arthropoda,Parthenogenetic,Internal,Pest,Lab,Lab-reared,Experimental,Terrestrial,NA,NA,NA,More than 5 days,Adult,No,Constant,No,Yes,No,No,No,No,1,NA,Pathogen,NA,NA,"daily fecundity, lifetime fecundity",NA,Yes,NA,1,Yes,No,No,No,No,No,NA
Amanda Bretman,Exclude,sample sizes not clear,TEMP1845,1606,31,23C,"Scaccini et al, 2020",2020,Lethal and sub-lethal effects of low-temperature exposures on Halyomorpha halys (Hemiptera: Pentatomidae) adults before and after overwintering,10.1038/s41598-020-72120-5,Halyomorpha halys,Pentatomidae,Insecta,Arthropoda,Both sexes,Internal,Pest,Semi-natural,Wild-caught,Experimental,Terrestrial,Italy,Europe,NA,Less than 24 hrs,Adult,Yes,Constant,No,Yes,No,No,No,No,1,NA,No,NA,NA,Fecundity,NA,Yes,NA,2,Yes,No,No,No,Yes,No,NA
Rhonda Snook,Include,NA,TEMP1854,1614,31,14B,"Schöller and Hassan, 2001",2001,Comparative biology and life tables of Trichogramma evanescens and T-cacoeciae with Ephestia elutella as host at four constant temperatures,10.1046/j.1570-7458.2001.00754.x,"Trichogramma evanescens, Trichogramma cacoeciae",Trichogrammatidae,Insecta,Arthropoda,Females only,Internal,Control agent,Lab,Lab-reared,Experimental,Terrestrial,NA,NA,NA,More than 5 days,Adult,No,Constant,No,Yes,No,No,No,No,1,NA,No,NA,NA,Fecundity,NA,Yes,population growth rate provided,1,Yes,No,No,No,No,No,NA
Alessio,Exclude,sample sizes not clear,TEMP186,232,3,2B,"Berger et al, 2008",2008,What limits insect fecundity? Body size- and temperature-dependent egg maturation and oviposition in a butterfly,10.1111/j.1365-2435.2008.01392.x,Pararge aegeria,Nymphalidae,Insecta,Arthropoda,Females only,Internal,No,Lab,Wild-caught,Experimental,Terrestrial,Sweden,Europe,NA,More than 5 days,Mix,No,Constant,No,Yes,No,No,No,No,1,NA,No,Egg maturation rate,NA,Egg number,NA,Yes,NA,1,Yes,No,No,No,No,No,NA
Amanda Bretman,Exclude,Fluctuating temp. Same mean,TEMP1861,1621,31,23C,"Schwartz et al, 2016",2016,Effects of fluctuating temperature and food availability on reproduction and lifespan,10.1016/j.exger.2016.06.010,Daphnia pulex,Daphniidae,Crustacea,Arthropoda,Parthenogenetic,Internal,No,Lab,Lab-reared,Experimental,Aquatic,NA,NA,NA,More than 5 days,Mix,No,Fluctuating,No,Yes,No,No,No,No,1,NA,No,NA,NA,Fecundity,NA,Yes,NA,2,Yes,Yes,No,No,No,No,NA
Fay Frost,Include,NA,TEMP1862,1622,31,NA,"Schwarz, H.; Walzl, M. m. s.",1996,"Pairing, oviposition and development in two sibling species of phoretic mites (Acari: Mesostigmata: Parasitidae: Poecilochirus spp) associated with burying beetles (Coleoptera: Silphidae: Nicrophorus spp)",10.1080/00222939600771251,Poecilochirus carabi,Parasitidae,Arachnida,Arthropoda,Both Sexes,Internal,no,Lab,Lab-reared,Experimental,Terrestrial,NA,NA,NA,Less than 24 hours,Adults,no,constant,no,yes,no,no,no,no,1,no,no,NA,NA,egg number,NA,Yes,NA,NA,NA,NA,NA,NA,NA,NA,NA
Rhonda Snook,Include,NA,TEMP1865,1624,31,14B,Seager 1991,1991,EFFECTS OF HIGH-TEMPERATURE STRESS ON ADULTS AND EGGS OF DROSOPHILA-ROBUSTA AND D-TRIPUNCTATA,10.2307/2426156,"Drosophila robusta, Drosophila tripunctata",Drosophilidae,Insecta,Arthropoda,Both sexes,Internal,No,Lab,Lab-reared,Experimental,Terrestrial,NA,NA,NA,More than 5 days,Adult,No,Constant,No,Yes,No,No,No,No,1,NA,No,NA,NA,"male fertility, female fertility",NA,Yes,NA,1,Yes,No,No,No,No,No,NA
Rhonda Snook,Exclude,age-specific fecundity,TEMP1866,1625,31,14B,"Seehausen et al, 2017",2017,Developmental and reproductive responses of the spruce budworm (Lepidoptera: Tortricidae) parasitoid Tranosema rostrale (Hymenoptera: Ichneumonidae) to temperature,10.1016/j.jinsphys.2016.11.008,Tranosema rostrale,Ichneumonidae,Insecta,Arthropoda,Females only,Internal,Control agent,Lab,Wild-caught,Experimental,Terrestrial,Canada,North America,NA,More than 5 days,Adult,No,Fluctuating,No,Yes,No,No,No,No,1,NA,No,NA,NA,Fecundity,NA,Yes,NA,1,Yes,No,No,No,No,No,NA
Rhonda Snook,Exclude,No SD,TEMP1871,1628,31,14A,"Sengonca et al, 2004",2004,Life table of the entomophagous ladybird Serangium parcesetosum Sicard (Coleoptera : Coccinellidae) by feeding on Bemisia tabaci (Genn.) (Homoptera : Aleyrodidae) as prey at two different temperatures and plant species,NA,Serangium parcesetosum,Coccinellidae,Insecta,Arthropoda,Both sexes,Internal,Control agent,Lab,Lab-reared,Experimental,Terrestrial,NA,NA,NA,More than 5 days,Adult,No,Constant,No,Yes,No,No,No,No,1,NA,No,NA,NA,Fecundity,NA,Yes,No standard error provided on fecundity data but there is extractable data for survival,1,Yes,No,No,No,No,No,NA
Fay Frost,Include,NA,TEMP1873,1631,31,C,"Seo et al, 2020",2020,"Development, Reproduction, and Life Table Parameters of the Foxglove Aphid, Aulacorthum solani Kaltenbach (Hemiptera: Aphididae), on Soybean at Constant Temperatures",10.3390/insects11050296,Aulacorthum solani,Aphididae,Insecta,Arthropoda,Parthenogenetic,Internal,Pest,Lab,Lab-reared,Experimental,Terrestrial,NA,NA,NA,More than 5 days,Mix,Yes,Constant,No,Yes,No,No,No,No,1,NA,No,NA,NA,Fecundity,NA,Yes,NA,2,Yes,No,No,No,Yes,No,NA
Fay Frost,Exclude,Survival curve,TEMP1884,1640,31,C,"Seyahooei et al, 2018",2018,Temperature and Exposure Time in Cold Storage Reshape Parasitic Performance of Habrobracon hebetor (Hymenoptera: Braconidae),10.1093/jee/toy004,Habrobracon hebetor,Braconidae,Insecta,Arthropoda,Females only,Internal,Control agent,Lab,Lab-reared,Experimental,Terrestrial,NA,NA,NA,More than 5 days,Adult,Yes,Constant,No,Yes,No,No,No,No,1,NA,No,NA,NA,Fecundity,NA,Yes,NA,2,Yes,No,No,No,Yes,No,NA
Steve,Exclude,sample sizes not clear,TEMP189,233,3,3A,"Berkebile et al, 2006",2006,Laboratory environment effects on the reproduction and mortality of adult screwworm (Diptera : Calliphoridae,10.1590/S1519-566X2006000600010,Cochliomyia hominivorax,Calliphoridae,Insecta,Arthropoda,Both sexes,Internal,Pest,Lab,Lab-reared,Experimental,Terrestrial,NA,NA,NA,More than 5 days,Mix,No,Constant,No,Yes,No,No,No,No,1,NA,"Food, density, photoperiod",Egg size,Ovarian development,Egg fertility,NA,Yes,NA,1,Yes,No,No,No,No,No,NA
Fay Frost,Include,NA,TEMP1893,1646,31,NA,"SHANOWER, T.et al.",1993,"DEVELOPMENT AND FECUNDITY OF SESAMIA-CALAMISTIS (LEPIDOPTERA, NOCTUIDAE) AND ELDANA-SACCHARINA (LEPIDOPTERA, PYRALIDAE",10.1017/S0007485300034726,"Sesamia calamistis, Eldana saccharina","Noctudae, Pyralidae",Insecta,Arthropoda,Both Sexes,Internal,Pest,Lab,Lab-reared,Experimental,Terrestrial,NA,NA,NA,more than 5 days,mix,no,constant,no,yes,no,no,no,no,1,no,no,NA,NA,egg number,NA,Yes,NA,NA,NA,NA,NA,NA,NA,NA,NA
Fay Frost,Include,NA,TEMP1894,1647,31,NA,SHANOWER & GUTIERREZ,1993,"EFFECT OF TEMPERATURE ON DEVELOPMENT RATES, FECUNDITY AND LONGEVITY OF THE GROUNDNUT LEAF MINER, APROAEREMA-MODICELLA (LEPIDOPTERA, GELECHIIDAE), IN INDIA",10.1017/S0007485300029321,Aproaerema modicella,Gelechiidae,Insecta,Arthropoda,Both Sexes,Internal,Pest,Lab,Lab-reared,Experimental,Terrestrial,NA,NA,NA,more than 5 days,mix,no,constant,no,yes,no,no,no,no,1,no,no,NA,NA,egg number,NA,Yes,NA,NA,NA,NA,NA,NA,NA,NA,NA
Rhonda Snook,Exclude,No useable data,TEMP1896,1649,31,14B,"Sharifi et al, 2010",2010,The effect of frizzle gene and dwarf gene on reproductive performance of broiler breeder dams under high and normal ambient temperatures,10.3382/ps.2010-00921,Gallus gallus,Phasianidae,Aves,Chordata,Females only,Internal,Other,Lab,Lab-reared,Experimental,Terrestrial,NA,NA,NA,More than 5 days,Adult,No,Constant,No,Yes,No,No,No,No,1,NA,Diet,NA,NA,"egg production, fertility",NA,Yes,NA,1,Yes,No,No,No,No,No,NA
Alessio,Exclude,Survival only,TEMP19,111,1,2A,"Aguila, L. C. R.et al.",2020,Temperature-Dependent Demography and Population Projection of Tamarixia radiata (Hymenoptera: Eulophidea) reared on Diaphorina citri (Hemiptera: Liviidae),10.1093/jee/toz247,Tamarixia radiata,Eulophidae,Insecta,Arthropoda,Both sexes,Internal,Control agent,Lab,Lab-reared,Experimental,Terrestrial,NA,NA,NA,More than 5 days,Mix,No,Constant,No,Yes,No,No,No,No,1,NA,No,NA,NA,Fecundity,NA,Yes,NA,1,Yes,No,No,No,No,No,NA
Rhonda Snook,Include,NA,TEMP1907,1658,32,14A,"Shi, B. K.et al. (a)",2014,"Interactive Effects of Elevated CO2 and Temperature on Rice Planthopper, Nilaparvata lugens",10.1016/S2095-3119(14)60804-2,Nilaparvata lugens,Delphacidae,Insecta,Arthropoda,Both sexes,Internal,Pest,Lab,Lab-reared,Experimental,Terrestrial,NA,NA,NA,More than 5 days,Mix,No,Fluctuating,No,Yes,No,No,No,No,1,NA,CO2,NA,NA,Number of offspring,NA,Yes,MULTIPLE STRESSOR WITH CO2,1,Yes,No,No,No,No,No,NA
Rhonda Snook,Include,NA,TEMP1908,1659,32,14A,"Shi, C. H.et al.",2020,Effects of Non-Lethal High-Temperature Stress on Bradysia odoriphaga (Diptera: Sciaridae) Larval Development and Offspring,10.3390/insects11030159,Bradysia odoriphaga,Sciaridae,Insecta,Arthropoda,Both sexes,Internal,Pest,Lab,Lab-reared,Experimental,Terrestrial,NA,NA,NA,Less than 24 hrs,Mix,No,Constant,No,Yes,No,No,No,No,1,NA,No,NA,NA,Egg number,NA,Yes,NA,1,Yes,No,No,No,No,No,NA
Alessio,Include,NA,TEMP191,234,3,2B,"Bernal & Gonzalez, 1997",1997,Reproduction of Diaeretiella rapae on Russian wheat aphid hosts at different temperatures,10.1046/j.1570-7458.1997.00126.x,Diaeretiella rapae,Braconidae,Insecta,Arthropoda,Both sexes,Internal,Control agent,Lab,Lab-reared,Experimental,Terrestrial,NA,NA,NA,More than 5 days,Mix,No,Constant,No,Yes,No,No,No,No,1,NA,No,Egg load,NA,Egg fertility,NA,Yes,NA,1,Yes,No,No,No,No,No,NA
Rhonda Snook,Exclude,No sample size,TEMP1910,1660,32,14A,"Shi, S. S.et al. (b)",2014,"Development, Survival, and Reproduction of Megacopta cribraria (Heteroptera: Plataspidae) at Different Constant Temperatures",10.1603/EC14287,Megacopta cribraria,Plataspidae,Insecta,Arthropoda,Both sexes,Internal,Pest,Lab,Lab-reared,Experimental,Terrestrial,NA,NA,NA,More than 5 days,Mix,No,Constant,No,Yes,No,No,No,No,1,NA,No,NA,NA,Egg number,NA,Yes,NA,1,Yes,No,No,No,No,No,NA
Fay Frost,Exclude,No sample size,TEMP1915,1663,32,NA,"Shishehbor, P.; Brennan, P. A.",1996,"Adult longevity, fecundity, and population growth rates for Trialeurodes ricini misra (Homoptera: Aleyrodidae) at different constant temperatures",10.4039/Ent128859-5,Trialeurodes ricini,Aleyrodidae,Insecta,Arthropoda,Both sexes,Internal,Pest,Lab,Lab-reared,Experimental,Terrestrial,NA,NA,NA,more than 5 days,Adults only,no,constant,no,yes,no,no,no,no,1,no,no,NA,NA,number of eggs,NA,Yes,NA,NA,NA,NA,NA,NA,NA,NA,NA
Rhonda Snook,Include,NA,TEMP1918,1666,32,14B,"Shreevani, G. N.et al.",2017,"Environmental change and the phenology of Bt cotton aphid, Aphis gossypii Glover",NA,Aphis gossypii,Aphididae,Insecta,Arthropoda,Parthenogenetic,NA,Pest,Lab,Lab-reared,Experimental,Terrestrial,NA,NA,NA,More than 5 days,Mix,No,Constant,No,Yes,No,No,No,No,1,NA,CO2,NA,NA,Fecundity,NA,Yes,NA,1,Yes,No,No,No,No,No,NA
Amanda Bretman,Include,NA,TEMP1919,1667,32,23A,"Shumo, M.et al.",2019,Influence of Temperature on Selected Life-History Traits of Black Soldier Fly (Hermetia illucens) Reared on Two Common Urban Organic Waste Streams in Kenya,10.3390/ani9030079,Hermetia illucens,Stratiomyidae,Insecta,Arthropoda,Both sexes,Internal,Other,Lab,Lab-reared,Experimental,Terrestrial,NA,NA,NA,More than 5 days,Mix,No,Constant,No,Yes,No,No,No,No,1,NA,No,NA,NA,Egg number,NA,Yes,"unclear on sample size, 5 males and 5 females exposed to temps and the lifespan of adults and eggs measured, but says n = 5 (but this would be 10)",1,Yes,No,No,No,No,No,NA
Fay Frost,Include,NA,TEMP192,235,3,NA,Beserra et al,2009,"Effects of temperature on life cicle, thermal exigency and number of generations per year estimation of Aedes aegypti (Diptera, Culicidae",10.1590/S0073-47212009000200004,Aedes aegypti,Culicidae,Insecta,Arthropoda,Both sexes,Internal,Other,Lab,Wild-caught,Experimental,Both,Brazil,South America,NA,more than 5 days,mix,no,constant,no,yes,no,no,no,no,1,no,no,NA,NA,egg number,NA,Yes,NA,NA,NA,NA,NA,NA,NA,NA,NA
Amanda Bretman,Exclude,Fluctuating vs Constant. Same mean.,TEMP1923,1671,32,23A,"Silva, D. B.et al. (a)",2015,Life history data and population growth of Tuta absoluta at constant and alternating temperatures on two tomato lines,NA,Tuta absoluta,Gelechiidae,Insecta,Arthropoda,Both sexes,Internal,Pest,Lab,Lab-reared,Experimental,Terrestrial,NA,NA,NA,More than 5 days,Mix,No,Both,No,Yes,No,No,No,No,1,NA,No,NA,NA,Egg number,NA,Yes,only compares one constant to a fluctuating,1,Yes,No,No,No,No,No,NA
Amanda Bretman,Include,NA,TEMP1924,1672,32,21B,"Silva, D. B.et al. (b)",2015,Performance of the parasitoid Praon volucre in Aulacorthum solani at five temperatures,NA,Praon volucre,Braconidae,Insecta,Arthropoda,Females only,Internal,Control agent,Lab,Lab-reared,Experimental,Terrestrial,NA,NA,NA,More than 5 days,Adult,No,Constant,No,Yes,No,No,No,No,1,NA,No,NA,NA,Number of parasitised hosts,NA,Yes,NA,1,Yes,No,No,No,No,No,NA
Fay Frost,Exclude,Cold hardening,TEMP1936,1683,32,C,"Singh, K.et al.",2015,"Egg Viability, Mating Frequency and Male Mating Ability Evolve in Populations of Drosophila melanogaster Selected for Resistance to Cold Shock",10.1371/journal.pone.0129992,Drosophila melanogaster,Drosophilidae,Insecta,Arthropoda,Both sexes,Internal,No,Lab,Lab-reared,Experimental,Terrestrial,NA,NA,NA,Less than 24 hrs,Adult,Yes,Constant,Yes (multiple generations),Yes,No,No,No,No,1,NA,No,NA,NA,Fecundity,Mating rate,Yes,Experimental evolution,2,Yes,No,No,No,Yes,No,NA
Claire Smithson,Exclude,Survival curve,TEMP1939,1686,32,21B,"Sisodia, S.; Singh, B. m. j.",2002,Effect of temperature on longevity and productivity in Drosophila ananassae: Evidence for adaptive plasticity and trade-off between longevity and productivity,10.1023/A:1014640604740,Drosophila ananassae,Drosophilidae,Insecta,Arthropoda,Both sexes,Internal,No,Lab,Lab-reared,Experimental,Terrestrial,NA,NA,NA,More than 5 days,Mix,No,Constant,No,Yes,No,No,No,No,1,NA,No,NA,NA,Fecundity,NA,Yes,NA,1,Yes,No,No,No,No,No,NA
Alessio,Include,NA,TEMP194,237,3,2C,"Betini et al, 2020",2020,"Food availability modulates temperature-dependent effects on growth, reproduction, and survival in Daphnia magna",10.1002/ece3.5925,Daphnia magna,Daphniidae,Crustacea,Arthropoda,Females only,Internal,No,Lab,Lab-reared,Experimental,Aquatic,NA,NA,NA,More than 5 days,Adult,No,Constant,No,Yes,No,No,No,No,1,NA,Food,NA,NA,"Clutch size, Life-time reproductive success",NA,Yes,"half of females from cold and half from warm rearing background; also low and high food, put in separate effect sizes",2,Yes,Yes,No,No,No,No,NA
Fay Frost,Exclude,adult survival only at 1 temp (comparison of pre-treatment or not). Haven't included fecundity data for pre-treated groups,TEMP1940,1687,32,C,"Sisodia, S.; Singh, B. N.",2006,Effect of exposure to short-term heat stress on survival and fecundity in Drosophila ananassae,10.1139/Z06-075,Drosophila ananassae,Drosophilidae,Insecta,Arthropoda,Both sexes,Internal,No,Lab,Lab-reared,Experimental,Terrestrial,NA,NA,NA,Less than 24 hrs,Adult,No,Constant,No,Yes,No,No,No,No,1,NA,No,NA,NA,Fecundity,NA,Yes,NA,1,Yes,No,No,No,No,No,NA
Fay Frost,Include,NA,TEMP1941,1688,32,C,"Sithole, R.et al.",2017,"The influence of temperature on life history traits of Diadegma mollipla (Hymenoptera: Ichneumonidae), an African parasitoid of the diamondback moth, Plutella xylostella (Lepidoptera: Plutellidae",10.1007/s10526-017-9834-8,Diadegma mollipla,Ichneumonidae,Insecta,Arthropoda,Both sexes,Internal,Control agent,Lab,Lab-reared,Experimental,Terrestrial,NA,NA,NA,More than 5 days,Adult,No,Constant,No,Yes,No,No,No,No,1,NA,No,NA,NA,Number of parasitised hosts,NA,Yes,NA,1,Yes,No,No,No,No,No,NA
Fay Frost,Exclude,"Only survival curve for one temp, no sd for longevity. Fecundity included",TEMP1949,1694,32,NA,"SMITH, A. m. s.",1986,"FECUNDITY AND SURVIVAL OF THE COMMON ARMYWORM, MYTHIMNA-CONVECTA - EFFECTS OF TEMPERATURE AND LARVAL NUTRITION",10.1111/j.1570-7458.1986.tb02184.x,Mythima convecta,Noctuidae,Insecta,Arthropoda,Both Sexes,Internal,Pest,Lab,Lab-reared,Experimental,Terrestrial,NA,NA,NA,more than 5 days,Adults only,no,constant,no,yes,no,no,no,no,1,no,diet,NA,NA,"egg number, egg fertility, spermatophore number",mating rate,Yes,NA,NA,NA,NA,NA,NA,NA,NA,NA
Fay Frost,Include,NA,TEMP1952,1697,32,C,"Smith, L. m. o.",2014,"Prediction of the Geographic Distribution of the Psyllid, Arytinnis hakani (Homoptera: Psyllidae), a Prospective Biological Control Agent of Genista monspessulana, Based on the Effect of Temperature on Development, Fecundity, and Survival",10.1603/EN14086,Arytinnis hakani,Psyllidae,Insecta,Arthropoda,Both sexes,Internal,Control agent,Lab,Lab-reared,Experimental,Terrestrial,NA,NA,NA,More than 5 days,Adult,Yes,Constant,No,Yes,No,No,No,No,1,NA,No,NA,NA,Fecundity,NA,Yes,NA,2,Yes,No,No,No,Yes,No,NA
Fay Frost,Include,NA,TEMP1954,1699,32,C,"SO, P.; TAKAFUJI, A.",1991,COEXISTENCE OF TETRANYCHUS-URTICAE (ACARINA - TETRANYCHIDAE) WITH DIFFERENT CAPACITIES FOR DIAPAUSE - COMPARATIVE LIFE-HISTORY TRAITS,10.1007/BF00323792,Tetranychus urticae,Tetranychidae,Arachnida,Arthropoda,Both sexes,Internal,Pest,Lab,Lab-reared,Experimental,Terrestrial,NA,NA,NA,More than 5 days,Mix,No,Both,No,Yes,No,No,No,No,1,NA,No,NA,NA,Fecundity,NA,Yes,NA,1,Yes,No,No,No,No,No,NA
Fay Frost,Exclude,"Not research question- diff rear temps,acclimitisation study",TEMP1955,1700,33,C,Sod-Moriah.U. A. et al.,1974,"INTRASCROTAL TEMPERATURE, TESTICULAR HISTOLOGY AND FERTILITY OF HEAT-ACCLIMATIZED RATS",10.1530/jrf.0.0370263,Rattus norvegicus,Muridae,Mammalia,Chordata,Males only,Internal,No,Lab,Lab-reared,Experimental,Terrestrial,NA,NA,NA,More than 5 days,Adult,No,Constant,No,Yes,No,No,No,No,1,NA,No,NA,Testes form,"Offspring number, Conception rate",Mating rate,Yes,NA,1,Yes,No,No,No,No,No,NA
Natalie Pilakouta,Include,NA,TEMP1964,1705,33,24C,"Souza, M. F.; Davis, J. A.",2020,Potential population growth of Melanaphis sacchari (Zehntner) (Hemiptera: Aphididae) under six constant temperatures on grain sorghum (Sorghum bicolor L.),10.1653/024.103.0419,Melanaphis sacchari,Aphididae,Insecta,Arthropoda,Parthenogenetic,Internal,Pest,Lab,Wild-caught,Experimental,Terrestrial,USA,North America,NA,More than 5 days,Adult,Yes,Constant,Yes (>4 days),Yes,No,No,No,No,1,NA,No,NA,NA,"Fecundity, Fertility",NA,Yes,NA,2,Yes,No,No,No,Yes,No,NA
Natalie Pilakouta,Include,NA,TEMP1965,1706,33,24C,"Souza, M. F.et al.",2017,"Influence of Host Quality and Temperature on the Biology of Diaeretiella rapae (Hymenoptera: Braconidae, Aphidiinae)",10.1093/ee/nvx108,"Myzus persicae, Lipaphis pseudobrassicae",Aphididae,Insecta,Arthropoda,Parthenogenetic,Internal,Pest,Lab,Wild-caught,Experimental,Terrestrial,Brazil,South America,NA,More than 5 days,Mix,Yes,Constant,Yes (> 4 days),Yes,No,No,No,No,1,NA,No,NA,NA,Fecundity,NA,Yes,NA,2,Yes,No,No,No,Yes,No,NA
