--,Decision,Exclusion reason,Paper code,Paper number,Screening set,Extraction set,Paper,Publication year,Title,DOI,Species latin,Family,Class,Phylum,Sex exposed,Fertilisation mode,Agricultural importance,Lab or field,Animal origin,Stressor variation,Habitat,Country of origin,Continent of origin,Ocean/sea of origin,Exposure duration,Life-stage of animal,Lowest temp below 10°C?,Constant or fluctuating?,Acclimated?,Temperature,Humidity,pH,Salinity,Radiation,Number of stressors,Interaction effects?,Other stressors,Gamete traits,Gonad traits,Reproductive output,Mating behaviour,Survival,Comments,Number of projects,#SURVIVAL,#AQUATIC,#WILD,#SPERM,#COLD,#INTERACTION,...52
Fay Frost,Exclude,Cold hardening,TEMP2314,1994,38,C,"Zhou, Z.-S.et al. (b)",2011,"Rapid cold-hardening response in Ophraella communa LeSage (Coleoptera: Chrysomelidae), a biological control agent of Ambrosia artemisiifolia L",10.1080/09583157.2010.534549,Ophraella communa,Chrysomelidae,Insecta,Arthropoda,Both sexes,Internal,Control agent,Lab,Lab-reared,Experimental,Terrestrial,NA,NA,NA,Less than 24 hrs,Mix,Yes,Constant,No,Yes,No,No,No,No,1,NA,No,NA,NA,Fecundity,NA,Yes,NA,2,Yes,No,No,No,Yes,No,NA
Jasper Rees,Exclude,sample sizes not clear,TEMP2318,1998,38,17A,"Zhu, G. D.et al.",2018,"Effects of high-temperature stress and heat shock on two root maggots, Bradysia odoriphaga and Bradysia difformis (Diptera: Sciaridae)",10.1016/j.aspen.2017.11.001,"Bradysia odoriphaga, Bradysia difformis",Sciaridae,Insecta,Arthropoda,Both sexes,Internal,Pest,Lab,Lab-reared,Experimental,Terrestrial,NA,NA,NA,More than 5 days,Mix,No,Constant,No,Yes,No,No,No,No,1,NA,No,NA,NA,Fecundity,NA,Yes,NA,1,Yes,No,No,No,No,No,NA
Jasper Rees,Include,NA,TEMP2319,1999,38,17A,"Zhu, G.et al. (a)",2017,"Effects of short-term heat shock and physiological responses to heat stress in two Bradysia adults, Bradysia odoriphaga and Bradysia difformis",10.1038/s41598-017-13560-4,"Bradysia odoriphaga, Bradysia difformis",Sciaridae,Insecta,Arthropoda,Both sexes,Internal,Pest,Lab,Lab-reared,Experimental,Terrestrial,NA,NA,NA,Less than 24 hrs,Adult,No,Constant,No,Yes,No,No,No,No,1,NA,No,NA,NA,Fecundity,NA,Yes,NA,1,Yes,No,No,No,No,No,NA
Ben Cole,Exclude,Fluctuating temp where mean isn't appropriate,TEMP2321,2000,38,18B,"Zhu, L.et al.",2019,Sporadic short temperature events cannot be neglected in predicting impacts of climate change on small insects,10.1016/j.jinsphys.2018.12.003,Sitobion avenae,Aphididae,Insecta,Arthropoda,Parthenogenetic,Internal,Pest,Lab,Lab-reared,Experimental,Terrestrial,NA,NA,NA,More than 5 days,Mix,No,Fluctuating,No,Yes,No,No,No,No,1,NA,No,NA,NA,Fecundity,NA,Yes,Fluctuating temperature regimes,1,Yes,No,No,No,No,No,NA
Ben Cole,Exclude,No SD,TEMP2323,2001,38,18B,"Zhu, Y. W.et al. (b)",2017,"Impact of maternal heat stress in conjunction with dietary zinc supplementation on hatchability, embryonic development, and growth performance in offspring broilers",10.3382/ps/pew481,Gallus gallus,Phasianidae,Aves,Chordata,Females only,Internal,No,Lab,Lab-reared,Experimental,Terrestrial,NA,NA,NA,More than 5 days,Adult,No,Constant,No,Yes,No,No,No,No,1,NA,No,NA,NA,Proportion of fertile eggs,NA,Yes,NA,1,Yes,No,No,No,No,No,NA
Alessio,Include,"Lots of strains of species, just taken one strain",TEMP239,275,4,2C,"Bouletreau-Merle et al, 2003",2003,Divergent strategies in low temperature environment for the sibling species Drosophila melanogaster and D-simulans: overwintering in extension border areas of France and comparison with African populations,10.1023/B:EVEC.0000005632.21186.21,"Drosophila melanogaster, Drosophila simulans",Drosophilidae,Insecta,Arthropoda,Both sexes,Internal,No,Lab,Lab-reared,Experimental,Terrestrial,NA,NA,NA,More than 5 days,Mix,Yes,Constant,No,Yes,No,No,No,No,1,NA,No,NA,Number of ovarioles,Fecundity,NA,Yes,NA,2,Yes,No,No,No,Yes,No,NA
Steve,Include,NA,TEMP240,276,4,3A,"Bounfour & Tanigoshi, 2001",2001,Effect of temperature on development and demographic parameters of Tetranychus urticae and Eotetranychus carpini borealis (Acari : Tetranychidae,NA,"Tetranychus urticae, Eotetranychus carpini",Tetranychidae,Arachnida,Arthropoda,Both sexes,Internal,Pest,Lab,Lab-reared,Experimental,Terrestrial,NA,NA,NA,More than 5 days,Mix,No,Constant,No,Yes,No,No,No,No,1,NA,No,NA,NA,Fecundity,NA,Yes,NA,1,Yes,No,No,No,No,No,NA
Alessio,Exclude,No SD,TEMP245,280,4,2C,"Brackenbury & Appleton, 1991",1991,EFFECT OF CONTROLLED TEMPERATURES ON GAMETOGENESIS IN THE GASTROPODS PHYSA-ACUTA (PHYSIDAE) AND BULINUS-TROPICUS (PLANORBIDAE,10.1093/mollus/57.4.461,"Physa acuta, Bulinus tropicus",Mix,Gastropoda,Mollusca,Hermaphrodite,Internal,No,Lab,Lab-reared,Experimental,Aquatic,NA,NA,NA,More than 5 days,Mix,No,Constant,No,Yes,No,No,No,No,1,NA,No,NA,onset of oogenesis and spermatogenesis,Fecundity,NA,Yes,NA,2,Yes,Yes,No,No,No,No,NA
Steve,Include,NA,TEMP249,284,4,3A,"Brar & Sharma, 2017",2017,Influence of temperature and carbon dioxide levels on growth and development of Spodoptera litura Fabricius on cauliflower,10.54386/jam.v19i4.596,Spodoptera litura,Noctuidae,Insecta,Arthropoda,Both sexes,Internal,Pest,Lab,Lab-reared,Experimental,Terrestrial,NA,NA,NA,More than 5 days,Mix,No,Fluctuating,No,Yes,No,No,No,No,1,NA,CO2,NA,NA,Fecundity,NA,Yes,NA,1,Yes,No,No,No,No,No,NA
Abhishek,Include,NA,TEMP25,7,T1,1A,"Ahn et al, 2019",2019,"Effects of temperature on the development, fecundity, and life table parameters of Riptortus pedestris (Hemiptera: Alydidae",10.1007/s13355-018-0593-5,Riptortus pedestris,Alydidae,Insecta,Arthropoda,Both sexes,Internal,No,Lab,Lab-reared,Experimental,Terrestrial,NA,NA,NA,More than 5 days,Mix,No,Constant,No,Yes,No,No,No,No,1,NA,No,NA,NA,Egg number,NA,Yes,"Pre-oviposition period, oviposition days, hatchability data present",1,Yes,No,No,No,No,No,NA
Alessio,Exclude,Cold hardening,TEMP257,291,4,2C,"Broufas & Koveos, 2001",2001,Cold hardiness characteristics in a strain of the predatory mite Euseius (Amblyseius) finlandicus (Acari : Phytoseiidae) from northern Greece,NA,Euseius finlandicus,Phytoseiidae,Arachnida,Arthropoda,Females only,Internal,No,Lab,Lab-reared,Experimental,Terrestrial,NA,NA,NA,Less than 24 hrs,Adult,Yes,Constant,Yes (mix),Yes,No,No,No,No,1,NA,No,NA,NA,Fecundity,NA,Yes,NA,2,Yes,No,No,No,Yes,No,NA
Alessio,Exclude,Cold hardening,TEMP258,292,4,2C,"Broufas & Koveos, 2001b",2001,Rapid cold hardening in the predatory mite Euseius (Amblyseius) finlandicus (Acari : Phytoseiidae),10.1016/S0022-1910(00)00162-1,Euseius finlandicus,Phytoseiidae,Arachnida,Arthropoda,Females only,Internal,No,Lab,Lab-reared,Experimental,Terrestrial,NA,NA,NA,Less than 24 hrs,Adult,Yes,Constant,Yes (mix),Yes,No,No,No,No,1,NA,No,NA,NA,Fecundity,NA,Yes,NA,2,Yes,No,No,No,Yes,No,NA
Alessio,Exclude,bootstrapped SEs,TEMP26,114,1,2A,"Ahn, J. J.et al.",2020,Thermal Effects on the Population Parameters and Growth of Acyrthosiphon pisum(Harris) (Hemiptera: Aphididae),10.3390/insects11080481,Acyrthosiphon pisum,Aphididae,Insecta,Arthropoda,Parthenogenetic,Internal,Pest,Lab,Lab-reared,Experimental,Terrestrial,NA,NA,NA,More than 5 days,Mix,No,Constant,No,Yes,No,No,No,No,1,NA,No,NA,NA,Fecundity,NA,Yes,NA,1,Yes,No,No,No,No,No,NA
Marco Graziano,Exclude,No sample size,TEMP264,297,4,20A,"Brugnano et al, 2014",2014,Fecundity and development of the bentho-pelagic copepod Pseudocyclops umbraticus: effects of temperature,10.3354/ab00562,Pseudocyclops umbraticus,Pseudocyclopidae ,Crustacea,Arthropoda,Both sexes,Internal,No,Lab,Wild-caught,Experimental,Aquatic,Italy,Europe,Italy,More than 5 days,Adult,No,Constant,No,Yes,No,No,No,No,1,NA,No,NA,NA,Fecundity,NA,Yes,NA,2,Yes,Yes,No,No,No,No,NA
Marco Graziano,Include,NA,TEMP265,298,4,20A,"Brugnano ez al, 2009",2009,"Temperature effects on fecundity, development and survival of the benthopelagic calanoid copepod, Pseudocyclops xiphophorus",10.1007/s00227-008-1086-9,Pseudocyclops xiphophorus,Pseudocyclopidae ,Crustacea,Arthropoda,Both sexes,Internal,No,Lab,Wild-caught,Experimental,Aquatic,Italy,Europe,Italy,More than 5 days,Adult,No,Constant,No,Yes,No,No,No,No,1,NA,No,NA,NA,Fecundity,NA,Yes,NA,2,Yes,Yes,No,No,No,No,NA
Fay Frost,Include,NA,TEMP268,301,5,C,"Bueno, V. H. P.et al.",2016,Reproduction and population parameters of the Nearctic predator Geocoris punctipes at constant and varying temperature regimes,10.1111/jen.12261,Geocoris punctipes,Geocoridae,Insecta,Arthropoda,Both sexes,Internal,Control agent,Lab,Lab-reared,Experimental,Terrestrial,NA,NA,NA,More than 5 days,Mix,No,Both,No,Yes,No,No,No,No,1,NA,No,NA,NA,Fecundity,NA,Yes,NA,1,Yes,No,No,No,No,No,NA
Fay Frost,Include,NA,TEMP282,315,5,NA,"BUTLER, G.et al.",1983,"CARDIOCHILES-NIGRICEPS (HYMENOPTERA, BRACONIDAE) - DEVELOPMENT TIME AND FECUNDITY IN RELATION TO TEMPERATURE",10.1093/aesa/76.3.536,Cardiochiles nigriceps,Braconidae,Insecta,Arthropoda,Both Sexes,Internal,Control agent,Lab,Wild-caught,Experimental,Terrestrial,USA,North America,NA,more than 5 days,mix,no,both,no,yes,no,no,no,no,1,no,no,NA,NA,egg number,NA,Yes,NA,NA,NA,NA,NA,NA,NA,NA,NA
Marco Graziano,Exclude,sample sizes not clear,TEMP285,317,5,20,"Butts, R.; Schaalje, G. m. j.",1997,"Impact of subzero temperatures on survival, longevity, and natality of adult Russian wheat aphid (Homoptera: Aphididae",10.1093/ee/26.3.661,Diuraphis noxia,Aphididae,Insecta,Arthropoda,Parthenogenetic,Internal,Pest,Lab,Lab-reared,Experimental,Terrestrial,NA,NA,NA,More than 5 days,Adult,Yes,Constant,No,Yes,No,No,No,No,1,NA,No,NA,NA,Number of nymphs per female,NA,Yes,NA,2,Yes,No,No,No,Yes,No,NA
Fay Frost,Include,NA,TEMP286,318,5,C,"Bybee, L. F.et al.",2004,Effects of temperature on fecundity and longevity of Phoracantha recurva and P-semipunctata (Coleoptera : Cerambycidae),10.1603/0046-225X-33.2.138,"Phoracantha recurva, Phoracantha semipunctata",Cerambycidae,Insecta,Arthropoda,Both sexes,Internal,Pest,Lab,Lab-reared,Experimental,Terrestrial,NA,NA,NA,More than 5 days,Adult,No,Constant,No,Yes,No,No,No,No,1,NA,No,NA,NA,Offspring production,NA,Yes,NA,1,Yes,No,No,No,No,No,NA
Fay Frost,Include,NA,TEMP293,325,5,C,"Cakmak, I.et al.",2011,"Life history of Sancassania polyphyllae (Acari: Acaridae) feeding on dissected tissues of its phoretic host, Polyphylla fullo (Coleoptera: Scarabaeidae): temperature effects",10.1007/s10493-010-9386-4,Sancassania polyphyllae,Acaridae,Arachnida,Arthropoda,Both sexes,Internal,No,Lab,Lab-reared,Experimental,Terrestrial,NA,NA,NA,More than 5 days,Mix,No,Constant,No,Yes,No,No,No,No,1,NA,No,NA,NA,Offspring production,NA,Yes,NA,1,Yes,No,No,No,No,No,NA
Amber Chatten,Include,Has net reproductive rate,TEMP298,327,5,19,"Calvo, F. J.et al.",2013,Host instar suitability and life-history parameters under different temperature regimes of Necremnus artynes on Tuta absoluta,10.1080/09583157.2013.795930,Necremnus artynes,Eulophidae,Insecta,Arthropoda,Both sexes,Internal,Control agent,Lab,Lab-reared,Experimental,Terrestrial,NA,NA,NA,More than 5 days,Adult,No,Constant,No,Yes,No,No,No,No,1,NA,No,NA,NA,Offspring production,NA,Yes,NA,1,Yes,No,No,No,No,No,NA
Fay Frost,Exclude,age-specific fecundity,TEMP300,329,5,NA,"CAMPBELL, C.; HUTCHISON, W. m. f.",1995,"REARING METHODS AND DEMOGRAPHIC-STATISTICS FOR A SUBTERRANEAN MORPH OF THE SUGAR-BEET ROOT APHID (HOMOPTERA, APHIDIDAE",10.4039/Ent12765-1,Pemphigus betae,Aphididae,Insecta,Arthropoda,Parthenogenetic,Internal,Pest,Lab,Lab-reared,Experimental,Terrestrial,NA,NA,NA,more than 5 days,Adults only,no,constant,no,yes,no,no,no,no,1,no,no,NA,NA,number of nymphs produced,NA,Yes,NA,NA,NA,NA,NA,NA,NA,NA,NA
Fay Frost,Exclude,age-specific fecundity,TEMP302,330,5,NA,"CAMPORESE, P.; DUSO, C. m. n.",1995,LIFE-HISTORY AND LIFE TABLE PARAMETERS OF THE PREDATORY MITE TYPHLODROMUS-TALBII,10.1111/j.1570-7458.1995.tb01995.x,Typhlodromus talbi,Phytoseiidae,Arachnida,Arthropoda,mix,Internal,Control agent,Lab,Lab-reared,Experimental,NA,NA,NA,NA,more than 5 days,unsure,no,constant,no,yes,no,no,no,no,1,no,no,NA,NA,number of eggs,NA,Yes,NA,NA,NA,NA,NA,NA,NA,NA,NA
Fay Frost,Exclude,Fluctuating temp where mean isn't appropriate,TEMP303,331,5,C,"Campos, F. A.et al.",2017,Does climate variability influence the demography of wild primates? Evidence from long-term life-history data in seven species,10.1111/gcb.13754,"Propithecus verreauxi, Cebus capucinus, Brachyteles hypoxanthus, Cercopithecus mitis, Papio cynocephalus, Pan troglodytes, Gorilla beringei",Mix,Mammalia,Chordata,Both sexes,Internal,No,Field,Wild,Natural,Terrestrial,Mix,Mix,NA,Natural variation,Mix,Yes,Fluctuating,NA,Yes,Yes,No,No,No,2,No,No,NA,NA,Offspring production,NA,Yes,NA,3,Yes,No,Yes,No,Yes,No,NA
Abhishek,Exclude,Fecundity data is confound with 2-3 different variable and data is weird and survival method is different from other studies meaning they measured without food and water.,TEMP305,26,T3,1B,"Cancino, et al, 2017",2017,Packaging conditions for the field release of the fruit fly parasitoid Diachasmimorpha longicaudata (Hymenoptera: Braconidae,10.1111/aen.12229,Diachasmimorpha longicaudata,Braconidae,Insecta,Arthropoda,Both sexes,Internal,Control agent,Lab,Lab-reared,Experimental,Terrestrial,NA,NA,NA,More than 5 days,Juvenile,No,Both,No,Yes,No,No,No,No,1,NA,"Hypoxia, density, photoperiod",NA,NA,Fecundity,NA,Yes,NA,1,Yes,No,No,No,No,No,NA
Amber Chatten,Exclude,No SD,TEMP306,332,5,19,"Canhilal, R.et al.",2001,"Effects of temperature on development and reproduction of a predatory beetle, Nephus includens kirsch (Coleoptera : Coccinellidae)",NA,Nephus includens,Coccinellidae,Insecta,Arthropoda,Both sexes,Internal,Control agent,Lab,Lab-reared,Experimental,Terrestrial,NA,NA,NA,More than 5 days,Mix,No,Constant,No,Yes,No,No,No,No,1,NA,No,NA,NA,Offspring production,NA,Yes,NA,1,Yes,No,No,No,No,No,NA
Fay Frost,Exclude,Fluctuating temp where mean isn't appropriate,TEMP308,333,5,C,"Cao, J. Y.et al.",2018,Effects of developmental acclimation on fitness costs differ between two aphid species,10.1016/j.jtherbio.2018.09.004,Rhopalosiphum padi,Aphididae,Insecta,Arthropoda,Parthenogenetic,NA,Pest,Lab,Lab-reared,Experimental,Terrestrial,NA,NA,NA,More than 5 days,Mix,No,Fluctuating,No,Yes,No,No,No,No,1,NA,No,NA,NA,Fecundity,NA,Yes,NA,1,Yes,No,No,No,No,No,fluctuating temps
Abhishek,Include,NA,TEMP309,28,T3,1A,"Cao et al, 2018",2018,Effects of Temperature on the Development and Reproduction of Thrips hawaiiensis (Thysanoptera: Thripidae,10.1093/jee/tox359,Thrips hawaiiensis,Thripidae,Insecta,Arthropoda,Both sexes,Internal,Pest,Lab,Lab-reared,Experimental,Terrestrial,NA,NA,NA,More than 5 days,Mix,No,Constant,No,Yes,No,No,No,No,1,NA,No,NA,NA,Fecundity,NA,Yes,"Sex ratio, fecundity rate, net reproductive rate, Generation time data present",1,Yes,No,No,No,No,No,NA
Abhishek,Exclude,Fluctuating temp. Same mean,TEMP310,29,T3,1A,"Cao et al, 2019",2019,Population development of Frankliniella occidentalis and Thrips hawaiiensis in constant and fluctuating temperatures,10.1111/jen.12571,"Frankliniella occidentalis, Thrips hawaiiensis",Thripidae,Insecta,Arthropoda,Both sexes,Internal,Pest,Lab,Lab-reared,Experimental,Terrestrial,NA,NA,NA,More than 5 days,Mix,No,Both,No,Yes,No,No,No,No,1,NA,No,NA,NA,Fecundity,NA,Yes,NA,1,Yes,No,No,No,No,No,NA
Fay Frost,Include,NA,TEMP323,343,5,NA,"Carvalho, L. M.et al.",2005,"Influence of temperature on the reproduction and longevity of the predator Otius thyestes Herring (Hemiptera, Anthocoridae)",10.1590/S0085-56262005000300010,Orius thyestes,Anthocoridae,Insecta,Arthropoda,Both sexes,Internal,Control agent,Lab,Lab-reared,Experimental,Terrestrial,NA,NA,NA,more than 5 days,Adults only,no,constant,no,yes,no,no,no,no,1,no,no,NA,NA,"egg number, egg viability",NA,Yes,NA,NA,NA,NA,NA,NA,NA,NA,NA
Fay Frost,Include,NA,TEMP330,350,5,C,"Castillo, J.et al.",2006,"Effect of temperature on life history of Quadrastichus haitiensis (Hymenoptera : Eulophidae), an endoparasitoid of Diaprepes abbreviatus (Coleoptera : Curculionidae)",10.1016/j.biocontrol.2005.09.023,Quadrastichus haitiensis,Eulophidae,Insecta,Arthropoda,Both sexes,Internal,Control agent,Lab,Lab-reared,Experimental,Terrestrial,NA,NA,NA,More than 5 days,Adult,No,Constant,No,Yes,No,No,No,No,1,NA,No,NA,NA,Offspring production,NA,Yes,NA,1,Yes,No,No,No,No,No,NA
Amber Chatten,Exclude,No sample size,TEMP331,351,6,19,"Castro, C. F.et al.",2011,THE IMPACT OF TEMPERATURE ON BIOLOGICAL ASPECTS AND LIFE TABLE OF HARMONIA AXYRIDIS (PALLAS) (COLEOPTERA: COCCINELLIDAE),10.1653/024.094.0429,Harmonia axyridis,Coccinellidae,Insecta,Arthropoda,Both sexes,Internal,Control agent,Lab,Lab-reared,Experimental,Terrestrial,NA,NA,NA,More than 5 days,Mix,No,Constant,No,Yes,No,No,No,No,1,NA,No,NA,NA,Fecundity,NA,Yes,NA,1,Yes,No,No,No,No,No,NA
Fay Frost,Exclude,No sample size,TEMP335,355,6,C,"Cavieres, G.et al.",2020,Rapid within- and transgenerational changes in thermal tolerance and fitness in variable thermal landscapes,10.1002/ece3.6496,Drosophila melanogaster,Drosophilidae,Insecta,Arthropoda,Both sexes,Internal,No,Lab,Lab-reared,Experimental,Terrestrial,NA,NA,NA,More than 5 days,Mix,No,Both,No,Yes,No,No,No,No,1,NA,No,NA,NA,Fecundity,NA,Yes,NA,1,Yes,No,No,No,No,No,NA
Fay Frost,Exclude,Natural variation in temp,TEMP340,359,6,C,"Chamaille-Jammes, S.et al.",2006,Global warming and positive fitness response in mountain populations of common lizards Lacerta vivipara,10.1111/j.1365-2486.2005.01088.x,Lacerta vivipara,Lacertidae,Reptilia,Chordata,Both sexes,Internal,No,Field,Wild,Natural,Terrestrial,France,Europe,NA,Natural variation,Adult,No,Fluctuating,NA,Yes,No,No,No,No,1,NA,No,NA,NA,Clutch mass,NA,Yes,NA,2,Yes,No,Yes,No,No,No,NA
Amber Chatten,Exclude,No SD,TEMP342,360,6,19,"CHANDRAKANTHA, J.et al.",1987,EFFECT OF TEMPERATURE AND HOST SEED SPECIES ON THE FECUNDITY OF CALLOSOBRUCHUS-MACULATUS (F,10.1007/BF03180005,Callosobruchus maculatus,Chrysomelidae,Insecta,Arthropoda,Both sexes,Internal,Pest,Lab,Lab-reared,Experimental,Terrestrial,NA,NA,NA,More than 5 days,Adult,No,Constant,No,Yes,No,No,No,No,1,NA,No,"Mass of egg, Energy of egg",NA,Egg number,NA,Yes,NA,1,Yes,No,No,No,No,No,NA
Fay Frost,Include,NA,TEMP346,364,6,NA,"Chang, Y.et al.",1996,"Reproduction and quality of F-1 offspring in Chrysoperla carnea: Differential influence of quiescence, artificially-induced diapause, and natural diapause",10.1016/0022-1910(96)00010-8,Chrysoperla carnea,Chrysopidae,Insecta,Arthropoda,Both Sexes,Internal,Control agent,Lab,Lab-reared,Experimental,Terrestrial,NA,NA,NA,more than 5 days,Adults,yes,constant,yes(mix),Yes,no,no,no,no,1,no,no,egg size,NA,"egg number, lifetime fertility, fertile oviposition",NA,Yes,NA,NA,NA,NA,NA,NA,NA,NA,NA
Fay Frost,Exclude,No SD,TEMP349,367,6,C,"Charles, J.; Allan, D. m. s.",2000,"Development of the willow sawfly, Nematus oligospilus, at different temperatures, and an estimation of voltinism throughout New Zealand",10.1080/03014223.2000.9518226,Nematus oligospilus,Tenthredinidae,Insecta,Arthropoda,Parthenogenetic,NA,No,Lab,Lab-reared,Experimental,Terrestrial,NA,NA,NA,More than 5 days,Mix,No,Constant,No,Yes,No,No,No,No,1,NA,No,NA,NA,Fecundity,NA,Yes,NA,1,Yes,No,No,No,No,No,NA
Alessio,Exclude,No temp/fecundity data,TEMP35,120,1,2A,"AKEY, D.et al.",1978,"EFFECTS OF REARING TEMPERATURE AND LARVAL DENSITY ON LONGEVITY, SIZE, AND FECUNDITY IN BITING GNAT CULICOIDES-VARIIPENNIS",10.1093/aesa/71.3.411,Culicoides variipennis,Ceratopogonidae,Insecta,Arthropoda,Females only,Internal,Pest,Lab,Lab-reared,Experimental,Terrestrial,NA,NA,NA,1 to 5 days,Mix,No,Constant,No,Yes,No,No,No,No,1,NA,Larval density,NA,NA,Fecundity,NA,Yes,NA,1,Yes,No,No,No,No,No,NA
Fay Frost,Exclude,Natural variation in temp,TEMP353,371,6,C,"Chase, M.et al.",2005,Effects of weather and population density on reproductive success and population dynamics in a Song Sparrow (Melospiza melodia) population: A long-term study,10.1093/auk/122.2.571,Melospiza melodia,Passerellidae,Aves,Chordata,Both sexes,Internal,No,Field,Wild,Natural,Terrestrial,USA,North America,NA,Natural variation,Mix,Yes,Fluctuating,NA,Yes,Yes,No,No,No,2,No,NA,NA,NA,Clutch size,NA,Yes,NA,3,Yes,No,Yes,No,Yes,No,NA
Fay Frost,Exclude,Natural variation in temp,TEMP355,373,6,C,"Chausson, A.et al. (a)",2014,Barn Owl (Tyto alba) breeding biology in relation to breeding season climate,10.1007/s10336-013-1012-x,Tyto alba,Tytonidae,Aves,Chordata,Both sexes,Internal,No,Field,Wild,Natural,Terrestrial,Switzerland,Europe,NA,Natural variation,Mix,Yes,Fluctuating,NA,Yes,Yes,No,No,No,2,No,No,Egg size,NA,Clutch size,NA,Yes,NA,3,Yes,No,Yes,No,Yes,No,NA
Amber Chatten,Include,NA,TEMP364,380,6,19,"Chen, H.et al.",2018,Effect of short-term high-temperature exposure on the life history parameters of Ophraella communa,10.1038/s41598-018-32262-z,Ophraella communa,Chrysomelidae,Insecta,Arthropoda,Both sexes,Internal,Control agent,Lab,Lab-reared,Experimental,Terrestrial,NA,NA,NA,More than 5 days,Mix,No,Constant,No,Yes,No,No,No,No,1,NA,No,NA,NA,"female proportion, fecundity",NA,Yes,NA,1,Yes,No,No,No,No,No,NA
Fay Frost,Include,NA,TEMP366,382,6,C,"Chen, J. Y.et al.",2015,"Influence of Constant Temperature on Development and Reproduction of Encarsia guadeloupae Viggiani (Hymenoptera: Aphelinidae), a Parasitoid of the Spiraling Whitefly Aleurodicus dispersus Russell (Hemiptera: Aleyrodidae",10.1007/s13744-015-0274-9,Encarsia guadeloupae,Aphelinidae,Insecta,Arthropoda,Females only,Internal,Control agent,Lab,Wild-caught,Experimental,Terrestrial,China,Asia,NA,More than 5 days,Mix,No,Constant,No,Yes,No,No,No,No,1,NA,No,NA,NA,Fecundity,NA,Yes,NA,1,Yes,No,No,No,No,No,NA
Fay Frost,Include,NA,TEMP368,384,6,C,"Chen, L.et al.",2021,"Acclimation for optimisation: effects of temperature on development, reproduction and size of Trichogramma achaeae",10.1080/09583157.2021.1963679,Trichogramma achaeae,Trichogrammatidae,Insecta,Arthropoda,Females only,Internal,Control agent,Lab,Lab-reared,Experimental,Terrestrial,NA,NA,NA,More than 5 days,Mix,No,Constant,Yes (mix),Yes,No,No,No,No,1,NA,No,NA,NA,Fecundity,NA,Yes,NA,1,Yes,No,No,No,No,No,NA
Valentina,Include,NA,TEMP369,385,6,4A,"Chen, Q.et al. (b)",2017,"Age-stage, two-sex life table of Parapoynx crisonalis (Lepidoptera: Pyralidae) at different temperatures",10.1371/journal.pone.0173380,Parapoynx crisonalis,Crambidae,Insecta,Arthropoda,Both sexes,Internal,Pest,Lab,Lab-reared,Experimental,Terrestrial,NA,NA,NA,More than 5 days,Mix,No,Constant,No,Yes,No,No,No,No,1,NA,No,NA,NA,Fecundity,NA,Yes,NA,1,Yes,No,No,No,No,No,NA
Valentina,Include,NA,TEMP370,386,6,4A,"Chen, W. H.et al.",2016,"Temperature-dependent development and life history of Oligonychus litchii (Acari: Tetranychidae), on wax apple",10.1016/j.aspen.2016.01.004,Oligonychus litchii,Tetranychidae,Arachnida,Arthropoda,Females only,Internal,Pest,Lab,Wild-caught,Experimental,Terrestrial,Taiwan,Asia,NA,More than 5 days,Mix,No,Constant,No,Yes,No,No,No,No,1,NA,No,NA,NA,Fecundity,NA,Yes,NA,1,Yes,No,No,No,No,No,NA
Fay Frost,Include,NA,TEMP371,387,6,C,"Chen, W. L.et al.",2006,"Development and reproduction of the egg parasitoid, Gonatocerus ashmeadi Girault (Hymenoptera : Mymaridae), as a function of temperature",10.1093/ee/35.5.1178,Gonatocerus ashmeadi,Mymaridae,Insecta,Arthropoda,Both sexes,Internal,Control agent,Lab,Lab-reared,Experimental,Terrestrial,NA,NA,NA,More than 5 days,Mix,No,Constant,No,Yes,No,No,No,No,1,NA,No,NA,NA,Fecundity,NA,Yes,NA,1,Yes,No,No,No,No,No,NA
Valentina,Exclude,No useable data,TEMP373,389,6,4A,"Chen, Z. Z.et al.",2019,"Effects of constant and fluctuating temperature on the development of the oriental fruit moth, Grapholita molesta (Lepidoptera: Tortricidae)",10.1017/S0007485318000469,Grapholita molesta,Tortricidae,Insecta,Arthropoda,Both sexes,Internal,Pest,Lab,Lab-reared,Experimental,Terrestrial,NA,NA,NA,More than 5 days,Mix,No,Both,No,Yes,No,No,No,No,1,NA,No,NA,NA,Fecundity,NA,Yes,NA,1,Yes,No,No,No,No,No,NA
Valentina,Exclude,No sample size,TEMP374,390,6,4A,"Cheng, J. X.et al.",2017,Effects of Heat Shock on the Bradysia odoriphaga (Diptera: Sciaridae),10.1093/jee/tox118,Bradysia odoriphaga,Sciaridae,Insecta,Arthropoda,Both sexes,Internal,No,Lab,Lab-reared,Experimental,Terrestrial,NA,NA,NA,Less than 24 hrs,Mix,No,Constant,No,Yes,No,No,No,No,1,NA,No,NA,NA,"Number of eggs, percentage of females that oviposited",number of pairs that copulated,Yes,NA,1,Yes,No,No,No,No,No,NA
Fay Frost,Exclude,age-specific fecundity,TEMP375,391,6,C,"Cheng, L. Y.et al.",2018,Effects of constant and fluctuating temperatures on development and reproduction of Megoura crassicauda and Aphis craccivora (Hemiptera: Aphididae),10.33338/ef.70036,"Megoura crassicauda, Aphis craccivora",Aphididae,Insecta,Arthropoda,Parthenogenetic,Internal,Pest,Lab,Lab-reared,Experimental,Terrestrial,NA,NA,NA,More than 5 days,Mix,No,Both,No,Yes,No,No,No,No,1,NA,No,NA,NA,Fecundity,NA,Yes,NA,1,Yes,No,No,No,No,No,NA
Valentina,Include,NA,TEMP376,392,6,4A,"Cheng, Y. X.et al.",2015,"Response of Reproductive Traits and Longevity of Beet Webworm to Temperature, and Implications for Migration",10.1093/jisesa/iev135,Loxostege sticticalis,Crambidae,Insecta,Arthropoda,Both sexes,Internal,Pest,Lab,Lab-reared,Experimental,Terrestrial,NA,NA,NA,More than 5 days,Mix,No,Constant,No,Yes,No,No,No,No,1,NA,No,NA,NA,Fecundity,Mating activity,Yes,NA,1,Yes,No,No,No,No,No,NA
Valentina,Include,NA,TEMP378,394,6,4A,"Chi, B. J.et al.",2016,"Temperature-dependent demography of Agriphila aeneociliella (Lepidoptera: Crambidae), a new insect pest of wheat in China",10.1111/afe.12151,Agriphila aeneociliella,Crambidae,Insecta,Arthropoda,Both sexes,Internal,Pest,Lab,Lab-reared,Experimental,Terrestrial,NA,NA,NA,More than 5 days,Mix,No,Constant,No,Yes,No,No,No,No,1,NA,No,NA,NA,Fecundity,NA,Yes,NA,1,Yes,No,No,No,No,No,NA
