--,Decision,Exclusion reason,Paper code,Paper number,Screening set,Extraction set,Paper,Publication year,Title,DOI,Species latin,Family,Class,Phylum,Sex exposed,Fertilisation mode,Agricultural importance,Lab or field,Animal origin,Stressor variation,Habitat,Country of origin,Continent of origin,Ocean/sea of origin,Exposure duration,Life-stage of animal,Lowest temp below 10°C?,Constant or fluctuating?,Acclimated?,Temperature,Humidity,pH,Salinity,Radiation,Number of stressors,Interaction effects?,Other stressors,Gamete traits,Gonad traits,Reproductive output,Mating behaviour,Survival,Comments,Number of projects,#SURVIVAL,#AQUATIC,#WILD,#SPERM,#COLD,#INTERACTION,...52
Jacintha Ellers,Include,NA,TEMP1137,1007,19,9A,"Li, W. B.et al.",2020,Effects of Temperature on the Development and Fecundity of Atractomorpha Sinensis (Orthoptera: Pyrgomorphidae),10.1093/jee/toaa145,Atractomorpha sinensis,Pyrgomorphidae,Insecta,Arthropoda,Both sexes,Internal,Pest,Lab,Lab-reared,Experimental,Terrestrial,NA,NA,NA,More than 5 days,Mix,No,Constant,No,Yes,No,No,No,No,1,NA,No,NA,NA,Egg number,NA,Yes,"pop growth rate (R0, r)",1,Yes,No,No,No,No,No,NA
Jacintha Ellers,Include,NA,TEMP1138,1008,19,9A,"Li, W. X.et al.",2015,"Effects of Temperature on the Age-Stage, Two-Sex Life Table of Bradysia odoriphaga (Diptera: Sciaridae)",10.1093/jee/tou011,Bradysia odoriphaga,Sciaridae,Insecta,Arthropoda,Both sexes,Internal,Pest,Lab,Lab-reared,Experimental,Terrestrial,NA,NA,NA,More than 5 days,Mix,No,Constant,No,Yes,No,No,No,No,1,NA,No,NA,NA,Egg number,NA,Yes,"pop growth rate (R0, r)",1,Yes,No,No,No,No,No,NA
Claire Smithson,Exclude,No sample size,TEMP1139,1009,19,21,"Li, W. Z.et al.",2021,"Effects of short-term heat stress on the development and reproduction of predatory mite Neoseiulus barkeri (Acari, Phytoseiidae)",10.11158/saa.26.4.5,Neoseiulus barkeri,Phytoseiidae,Arachnida,Arthropoda,Both sexes,Internal,No,Lab,Lab-reared,Experimental,Terrestrial,NA,NA,NA,Mix,Mix,No,Fluctuating,No,Yes,No,No,No,No,1,NA,No,NA,NA,Egg number,NA,Yes,NA,1,Yes,No,No,No,No,No,NA
Claire Smithson,Exclude,No sample size,TEMP1141,1010,19,21,"Li, Y. J.et al.",2019,Effects of temperature on a Chinese population of Amblyseius andersoni (Acari: Phytoseiidae) fed with Tetranychus urticae,10.24349/acarologia/20194344,Amblyseius andersoni,Phytoseiidae,Arachnida,Arthropoda,Both sexes,Internal,Pest,Lab,Lab-reared,Experimental,Terrestrial,NA,NA,NA,More than 5 days,Mix,No,Constant,No,Yes,No,No,No,No,1,NA,No,NA,NA,Egg number,NA,Yes,NA,1,Yes,No,No,No,No,No,NA
Marco Graziano,Include,NA,TEMP1147,1016,19,20,"Liang, L.-N.et al.",2014,"A Single Hot Event Stimulates Adult Performance but Reduces Egg Survival in the Oriental Fruit Moth, Grapholitha molesta",10.1371/journal.pone.0116339,Grapholita molesta,Tortricidae,Insecta,Arthropoda,Both sexes,Internal,Pest,Lab,Lab-reared,Experimental,Terrestrial,NA,NA,NA,Less than 24 hrs,Adult,No,Constant,No,Yes,No,No,No,No,1,NA,No,NA,NA,Egg number,copula duration,Yes,Both males and female effects on fecundity,1,Yes,No,No,No,No,No,NA
Pedro,Include,NA,TEMP1150,1018,19,11,"Liao, H. J.et al.",2014,Heat shock suppresses mating and sperm transfer in the rice leaf folder Cnaphalocrocis medinalis,10.1017/S0007485314000212,Cnaphalocrocis medinalis,Crambidae,Insecta,Arthropoda,Both sexes,Internal,Pest,Lab,Lab-reared,Experimental,Terrestrial,NA,NA,NA,Mix,Mix,No,Both,No,Yes,No,No,No,No,1,NA,No,sperm bundle number and size,Ovary development,Egg number,"copula duration, mating rate",Yes,includes survival curves,2,Yes,No,No,Yes,No,No,NA
Berta,Include,NA,TEMP1151,1019,19,10A,"Liao, Q. J.et al.",2017,"Temperature-dependent development and reproduction of rice leaffolder, Marasmia exigua (Lepidoptera: Pyralidae)",10.1371/journal.pone.0187972,Marasmia exigua,Crambidae,Insecta,Arthropoda,Both sexes,Internal,Pest,Lab,Lab-reared,Experimental,Terrestrial,NA,NA,NA,More than 5 days,Mix,No,Constant,No,Yes,No,No,No,No,1,NA,No,NA,NA,"number of eggs, lifetime fecundity",NA,Yes,NA,1,Yes,No,No,No,No,No,NA
Fay Frost,Exclude,No useable data,TEMP1155,1023,19,C,"Limbu, S.et al.",2017,Effects of Temperature on Development of Lymantria dispar asiatica and Lymantria dispar japonica (Lepidoptera: Erebidae),10.1093/ee/nvx111,Lymantria dispar,Erebidae,Insecta,Arthropoda,Both sexes,Internal,Pest,Lab,Lab-reared,Experimental,Terrestrial,NA,NA,NA,More than 5 days,Mix,Yes,Constant,No,Yes,Yes,No,No,No,2,No,No,NA,NA,"number of eggs, number of embryonated eggs",NA,Yes,NA,2,Yes,No,No,No,Yes,No,NA
Fay Frost,Include,NA,TEMP1157,1025,19,C,"Lin, J.et al.",2020,Quantification and Impact of Cold Storage and Heat Exposure on Mass Rearing Program of Bactrocera dorsalis (Diptera:Tephritidae) Genetic Sexing Strain,10.3390/insects11110821,Bactrocera dorsalis,Tephritidae,Insecta,Arthropoda,Both sexes,Internal,Pest,Lab,Lab-reared,Experimental,Terrestrial,NA,NA,NA,More than 5 days,Mix,No,Constant,No,Yes,No,No,No,No,1,NA,No,NA,NA,Egg number,mating competitiveness,Yes,NA,1,Yes,No,No,No,No,No,NA
Berta,Include,NA,TEMP1158,1026,19,10A,"Lin, M.-Y. m. d.",2013,Temperature-dependent life history of Oligonychus mangiferus (Acari: Tetranychidae) on Mangifera indica,10.1007/s10493-013-9716-4,Oligonychus mangiferus,Tetranychidae,Arachnida,Arthropoda,Both sexes,Internal,Pest,Lab,Lab-reared,Experimental,Terrestrial,NA,NA,NA,More than 5 days,Mix,No,Constant,No,Yes,No,No,No,No,1,NA,No,NA,NA,Egg number,NA,Yes,NA,1,Yes,No,No,No,No,No,NA
Fay Frost,Include,NA,TEMP1161,1029,19,C,"LINTS, F.; LINTS, C.",1971,INFLUENCE OF PREIMAGINAL ENVIRONMENT ON FECUNDITY AND AGING IN DROSOPHILA-MELANOGASTER HYBRIDS .2. PREIMAGINAL TEMPERATURE,10.1016/0531-5565(71)90021-0,Drosophila melanogaster,Drosophilidae,Insecta,Arthropoda,Both sexes,Internal,No,Lab,Lab-reared,Experimental,Terrestrial,NA,NA,NA,More than 5 days,Juvenile,No,Constant,No,Yes,No,No,No,No,1,NA,No,NA,NA,Egg number,NA,Yes,NA,1,Yes,No,No,No,No,No,NA
Fay Frost,Include,NA,TEMP1165,1033,19,C,"Liu, J. P.et al.",2021,"Impact of Temperature on Survival Rate, Fecundity, and Feeding Behavior of Two Aphids, Aphis gossypii and Acyrthosiphon gossypii, When Reared on Cotton",10.3390/insects12060565,"Aphis gossypii, Acyrthosiphon gossypii",Aphididae,Insecta,Arthropoda,Parthenogenetic,Internal,Pest,Lab,Lab-reared,Experimental,Terrestrial,NA,NA,NA,More than 5 days,Adult,No,Constant,No,Yes,No,No,No,No,1,NA,No,NA,NA,Number of offspring,NA,Yes,NA,1,Yes,No,No,No,No,No,NA
Fay Frost,Include,NA,TEMP1168,1036,19,C,"Liu, T.; Yue, B. m. j.",2001,Comparison of some life history parameters between alate and apterous forms of turnip aphid (Homoptera : Aphididae) on cabbage under constant temperatures,10.2307/3496173,Lipaphis erysimi,Aphididae,Insecta,Arthropoda,Parthenogenetic,Internal,Pest,Lab,Lab-reared,Experimental,Terrestrial,NA,NA,NA,More than 5 days,Mix,No,Constant,No,Yes,No,No,No,No,1,NA,No,NA,NA,Number of offspring,NA,Yes,NA,1,Yes,No,No,No,No,No,NA
Fay Frost,Include,NA,TEMP1169,1037,19,NA,"Liu, X. D.; Zhang, A. M.",2013,High temperature determines the ups and downs of small brown planthopper Laodelphax striatellus population,10.1111/j.1744-7917.2012.01533.x,Laodelphax striatellus,Delphacidae,Insecta,Arthropoda,Both sexes,Internal,Pest,Lab,Lab-reared,Experimental,Terrestrial,NA,NA,NA,more than 5 days,mix,no,constant,no,yes,no,no,no,no,1,no,no,NA,NA,egg number / number hatched,NA,Yes,NA,NA,NA,NA,NA,NA,NA,NA,NA
Fay Frost,Include,NA,TEMP1170,1038,19,C,"Liu, X.et al.",2015,Combined effects of temperature and food concentration on growth and reproduction of Eodiaptomus japonicus (Copepoda: Calanoida) from Lake Biwa (Japan),10.1111/fwb.12626,Eodiaptomus japonicus,Diaptomidae,Crustacea,Arthropoda,Both sexes,Internal,No,Lab,Lab-reared,Experimental,Aquatic,NA,NA,NA,More than 5 days,Mix,No,Constant,Yes (multiple generations),Yes,No,No,No,No,1,NA,Food level,NA,NA,Egg number,NA,Yes,NA,2,Yes,Yes,No,No,No,No,NA
Fay Frost,Include,NA,TEMP1172,1039,19,C,"Liu, Y. H.; Tsai, J. H.",2002,"Effect of temperature on development, survivorship, and fecundity of Lysiphlebia mirzai (Hymenoptera : Aphidiidae), a parasitoid of Toxoptera citricida (Homoptera : Aphididae)",10.1603/0046-225X-31.2.418,Lysiphlebia mirzai,Braconidae,Insecta,Arthropoda,Both sexes,Internal,Control agent,Lab,Lab-reared,Experimental,Terrestrial,NA,NA,NA,More than 5 days,Mix,No,Constant,No,Yes,No,No,No,No,1,NA,No,NA,NA,Egg number,NA,Yes,NA,1,Yes,No,No,No,No,No,NA
Berta,Include,NA,TEMP1173,1040,19,10A,"Liu, Y.-Y.et al. (b)",2018,Demography and Mass Rearing of the Medicinal Blister Beetle Epicauta impressicornis (Pic) (Coleoptera: Meloidae) at Different Temperatures,10.1093/jee/toy197,Epicauta impressicornis,Meloidae,Insecta,Arthropoda,Both sexes,Internal,Other,Lab,Lab-reared,Experimental,Terrestrial,NA,NA,NA,More than 5 days,Mix,No,Constant,No,Yes,No,No,No,No,1,NA,No,NA,NA,Egg number,NA,Yes,NA,1,Yes,No,No,No,No,No,NA
Pedro,Include,NA,TEMP1177,1044,19,11,"Lombaert, E.et al.",2008,"Phenotypic variation in invasive and biocontrol populations of the harlequin ladybird, Harmonia axyridis",10.1007/s10526-007-9131-z,Harmonia axyridis,Coccinellidae,Insecta,Arthropoda,Both sexes,Internal,No,Lab,Lab-reared,Experimental,Terrestrial,NA,NA,NA,More than 5 days,Mix,Yes,Constant,No,Yes,No,No,No,No,1,NA,No,NA,NA,Egg number,NA,Yes,NA,2,Yes,No,No,No,Yes,No,NA
Pedro,Exclude,No SD,TEMP1190,1053,20,11,"Lora-Vilchis, M.et al.",2003,"Histological characterization of the spawning process in the catarina scallop, Argopecten ventricosus (Sowerby II, 1842) induced by thermal shock and serotonin injection",10.1080/07924259.2003.9652558,Argopecten ventricosus,Pectinidae,Bivalvia,Mollusca,Both sexes,External,No,Lab,Wild-caught,Experimental,Aquatic,Mexico,North America,Gulf of California,Less than 24 hrs,Adult,No,Constant,No,Yes,No,No,No,No,1,NA,No,Sperm and egg latency time,NA,Spawning rate,NA,Yes,NA,3,Yes,Yes,No,Yes,No,No,NA
Berta,Include,NA,TEMP1192,1054,20,10A,"LOWRY, V.et al.",1992,"LIFE-FERTILITY TABLES FOR FRANKLINIELLA-FUSCA (HINDS) AND F-OCCIDENTALIS (PERGANDE) (THYSANOPTERA, THRIPIDAE) ON PEANUT",10.1093/aesa/85.6.744,"Frankliniella fusca, Frankliniella occidentalis",Thripidae,Insecta,Arthropoda,Both sexes,Internal,Pest,Lab,Lab-reared,Experimental,Terrestrial,NA,NA,NA,More than 5 days,Mix,No,Constant,Yes (> 4 days),Yes,No,No,No,No,1,NA,No,"Egg number, egg viability",NA,Population growth rate,NA,Yes,NA,1,Yes,No,No,No,No,No,NA
Berta,Exclude,No sample size,TEMP1193,1055,20,10A,"Lu, B. Q.et al.",2016,"Life table analysis under constant temperature for Opisina arenosella (Lepidoptera: Xyloryctidae), an invasive moth of palm plants",10.1111/aen.12195,Opisina arenosella,Xyloryctidae,Insecta,Arthropoda,Both sexes,Internal,Pest,Lab,Lab-reared,Experimental,Terrestrial,NA,NA,NA,More than 5 days,Mix,No,Constant,Yes (> 4 days),Yes,No,No,No,No,1,NA,No,Egg number,NA,Net reproductive rate,NA,Yes,NA,1,Yes,No,No,No,No,No,NA
Berta,Include,NA,TEMP1196,1058,20,10A,"Lu, M. X.et al.",2014,Heat tolerance of developmental and seasonal stages of Chilo suppressalis,10.1111/eea.12203,Chilo suppressalis,Crambidae,Insecta,Arthropoda,Both sexes,Internal,Pest,Lab,Wild-caught,Experimental,Terrestrial,China,Asia,NA,Less than 24 hrs,Adult,No,Constant,No,Yes,No,No,No,No,1,NA,No,NA,NA,Number of eggs/egg masses,NA,Yes,NA,1,Yes,No,No,No,No,No,NA
Berta,Include,NA,TEMP1197,1059,20,10A,"Lu, Y.et al.",2009,Comparative study of temperature-dependent life histories of three economically important Adelphocoris spp,10.1111/j.1365-3032.2009.00692.x,"Adelphocoris suturalis, Adelphocoris fasciaticollis, Adelphocoris lineolatus",Miridae,Insecta,Arthropoda,Both sexes,Internal,Pest,Lab,Lab-reared,Experimental,Terrestrial,NA,NA,NA,More than 5 days,Mix,No,Constant,Yes (> 4 days),Yes,No,No,No,No,1,NA,No,NA,NA,Fecundity,NA,Yes,NA,1,Yes,No,No,No,No,No,NA
Berta,Include,NA,TEMP1198,1060,20,10A,"Lu, Y.et al.",2010,"Temperature-dependent life history of the green plant bug, Apolygus lucorum (Meyer-Dur) (Hemiptera: Miridae",10.1303/aez.2010.387,Apolygus lucorum,Miridae,Insecta,Arthropoda,Both sexes,Internal,Pest,Lab,Lab-reared,Experimental,Terrestrial,NA,NA,NA,More than 5 days,Mix,No,Constant,Yes (> 4 days),Yes,No,No,No,No,1,NA,No,NA,NA,Fecundity,NA,Yes,NA,1,Yes,No,No,No,No,No,NA
Natalie Pilakouta,Include,NA,TEMP1205,1067,20,24B,"Luo, S.et al.",2015,"Effect of temperature on the reproductive biology of Peristenus spretus (Hymenoptera: Braconidae), a biological control agent of the plant bug Apolygus lucorum (Hemiptera: Miridae",10.1080/09583157.2015.1057697,Peristenus spretus,Braconidae,Insecta,Arthropoda,Both sexes,Internal,Control agent,Lab,Lab-reared,Experimental,Terrestrial,NA,NA,NA,More than 5 days,Mix,No,Constant,Yes (> 4 days),Yes,No,No,No,No,1,NA,No,NA,NA,Egg number,NA,Yes,NA,1,Yes,No,No,No,No,No,NA
Natalie Pilakouta,Include,NA,TEMP1207,1068,20,24B,"Luong, L. T.; Polak, M. m. j.",2007,Costs of resistance in the Drosophila-macrocheles system: A negative genetic correlation between ectoparasite resistance and reproduction,10.1111/j.1558-5646.2007.00116.x,Drosophila nigrospiracula,Drosophilidae,Insecta,Arthropoda,Both sexes,Internal,No,Lab,Lab-reared,Experimental,Terrestrial,NA,NA,NA,More than 5 days,Adult,No,Fluctuating,Yes (> 4 days),Yes,No,No,No,No,1,NA,No,NA,NA,Fecundity,NA,Yes,NA,1,Yes,No,No,No,No,No,NA
Jacintha Ellers,Include,NA,TEMP1214,1072,20,9B,"Ma, C.et al.",2004,"Effects of pattern and timing of high temperature exposure on reproduction of the rose grain aphid, Metopolophium dirhodum",10.1111/j.0013-8703.2004.00123.x,Metopolophium dirhodum,Aphididae,Insecta,Arthropoda,Parthenogenetic,Internal,Pest,Lab,Lab-reared,Experimental,Terrestrial,NA,NA,NA,Mix,Mix,No,Constant,No,Yes,No,No,No,No,1,NA,No,NA,NA,Fecundity,NA,Yes,Various exposure durations,1,Yes,No,No,No,No,No,NA
Berta,Exclude,No sample size,TEMP1216,1074,20,10A,"Ma, L.et al.",2017,Temperature effects on development and fecundity of Brachmia macroscopa (Lepidoptera: Gelechiidae,10.1371/journal.pone.0173065,Brachmia macroscopa,Gelechiidae,Insecta,Arthropoda,Both sexes,Internal,Pest,Lab,Lab-reared,Experimental,Terrestrial,NA,NA,NA,More than 5 days,Mix,No,Constant,Yes (> 4 days),Yes,No,No,No,No,1,NA,No,NA,NA,Fecundity,NA,Yes,NA,1,Yes,No,No,No,No,No,NA
Pedro,Include,NA,TEMP1217,1075,20,11,"Ma, Q.et al.",2010,Differences in life table demography among eight geographic populations of Brachionus calyciflorus (Rotifera) from China,10.1016/j.limno.2009.05.002,Brachionus calyciflorus,Brachionidae,Monogononta,Rotifera,Parthenogenetic,NA,No,Lab,Lab-reared,Experimental,Aquatic,NA,NA,NA,Mix,Mix,No,Constant,Yes (multiple generations),Yes,No,No,No,No,1,NA,No,Egg size,NA,Fecundity,NA,Yes,includes population growth data and survival curves; parthenogenetic,2,Yes,Yes,No,No,No,No,NA
Fay Frost,Exclude,sample sizes not clear,TEMP1218,1076,20,C,"Ma, Z. S.; Bechinski, E. J.",2009,Life tables and demographic statistics of Russian wheat aphid (Hemiptera: Aphididae) reared at different temperatures and on different host plant growth stages,10.14411/eje.2009.026,Diuraphis noxia,Aphididae,Insecta,Arthropoda,Parthenogenetic,Internal,Pest,Lab,Lab-reared,Experimental,Terrestrial,NA,NA,NA,More than 5 days,Mix,Yes,Fluctuating,No,Yes,No,No,No,No,1,NA,No,NA,NA,Fecundity,NA,Yes,NA,2,Yes,No,No,No,Yes,No,NA
Graziella Iossa,Include,NA,TEMP122,194,2,25B,"Aysal, T.; Kivan, M.",2008,Development and population growth of Stephanitis pyri (F.) (Heteroptera : Tingidae) at five temperatures,10.1007/s10340-008-0198-9,Stephanitis pyri,Tingidae,Insecta,Arthropoda,Both sexes,Internal,Pest,Lab,Lab-reared,Experimental,Terrestrial,NA,NA,NA,More than 5 days,Adult,No,Constant,No,Yes,No,No,No,No,1,NA,No,NA,NA,Fecundity,NA,Yes,NA,1,Yes,No,No,No,No,No,NA
Fay Frost,Exclude,Natural variation in temp,TEMP1220,1078,20,C,"Macdonald, D. W.et al.",2010,Are badgers `Under The Weather'? Direct and indirect impacts of climate variation on European badger (Meles meles) population dynamics,10.1111/j.1365-2486.2010.02208.x,Meles meles,Mustelidae,Mammalia,Chordata,Both sexes,Internal,Other,Field,Wild,Natural,Terrestrial,UK,Europe,NA,Natural variation,Mix,No,Fluctuating,NA,Yes,Yes,No,No,No,2,Yes,No,NA,NA,Fecundity,NA,Yes,NA,3,Yes,No,Yes,No,No,Yes,NA
Fay Frost,Exclude,boxplots,TEMP1222,1080,20,C,"Maceda-Veiga, A.et al.",2015,Chronic effects of temperature and nitrate pollution on Daphnia magna: Is this cladoceran suitable for widespread use as a tertiary treatment?,10.1016/j.watres.2015.06.036,Daphnia magna,Daphniidae,Crustacea,Arthropoda,Parthenogenetic,Internal,No,Lab,Lab-reared,Experimental,Aquatic,NA,NA,NA,More than 5 days,Mix,No,Constant,No,Yes,No,No,No,No,1,NA,Nitrate (pollution),NA,NA,Fecundity,NA,Yes,NA,2,Yes,Yes,No,No,No,No,NA
Jacintha Ellers,Include,NA,TEMP1230,1087,20,9B,"Mahroof, R.et al.",2005,Reproductive performance of Tribolium castaneum (Coleoptera : Tenebrionidae) exposed to the minimum heat treatment temperature as pupae and adults,10.1093/jee/98.2.626,Tribolium castaneum,Tenebrionidae,Insecta,Arthropoda,Both sexes,Internal,No,Lab,Lab-reared,Experimental,Terrestrial,NA,NA,NA,Less than 24 hrs,Mix,No,Constant,No,Yes,No,No,No,No,1,NA,No,NA,NA,Fecundity,NA,Yes,treatments are separate exposure of male and female,1,Yes,No,No,No,No,No,NA
Jacintha Ellers,Include,NA,TEMP1238,1094,20,9B,"Malekmohammadi, A.et al.",2012,"Influence of constant temperatures on development, reproduction and life table parameters of Encarsia inaron (Hymenoptera: Aphelinidae) parasitizing Neomaskellia andropogonis (Hemiptera: Aleyrodidae)",10.1016/j.cropro.2011.12.006,Encarsia inaron,Aphelinidae,Insecta,Arthropoda,Both sexes,Internal,Control agent,Lab,Lab-reared,Experimental,Terrestrial,NA,NA,NA,More than 5 days,Mix,No,Constant,No,Yes,No,No,No,No,1,NA,No,NA,NA,Fecundity,NA,Yes,"pop growth rate (R0, r)",1,Yes,No,No,No,No,No,NA
Berta,Exclude,No sample size,TEMP1243,1100,20,10A,Narayanasamy et al.,2016,Effect of elevated temperature on life-history parameters of rice yellow stem borer (Scirpophaga incertulas Walker),NA,Scirpophaga incertulas,Crambidae,Insecta,Arthropoda,Both sexes,Internal,Pest,Lab,Lab-reared,Experimental,Terrestrial,NA,NA,NA,More than 5 days,Mix,No,Constant,Yes (> 4 days),Yes,No,No,No,No,1,NA,No,NA,NA,Fecundity,NA,Yes,NA,1,Yes,No,No,No,No,No,NA
Jacintha Ellers,Exclude,Fertility or survival traits only measured at a single temperature,TEMP1246,1099,20,9B,"Manrique, V.et al.",2017,"Comparative Evaluation of Development and Reproductive Capacity of Two Biotypes of Lilioceris cheni (Coleoptera: Chrysomelidae), Biological Control Agents of Air Potato (Dioscorea Bulbifera) in Florida",10.1093/aesa/saw100,Lilioceris cheni,Chrysomelidae,Insecta,Arthropoda,Both sexes,Internal,Control agent,Lab,Lab-reared,Experimental,Terrestrial,NA,NA,NA,More than 5 days,Mix,No,Constant,Yes (> 4 days),Yes,No,No,No,No,1,NA,No,NA,NA,Fecundity,NA,Yes,"pop growth rate (R0, r)",1,Yes,No,No,No,No,No,NA
Graziella Iossa,Include,NA,TEMP125,197,2,25B,"Azrag, A. G. A.et al.",2020,"Modelling the effect of temperature on the biology and demographic parameters of the African coffee white stem borer, Monochamus leuconotus (Pascoe) (Coleoptera: Cerambycidae)",10.1016/j.jtherbio.2020.102534,Monochamus leuconotus,Cerambycidae,Insecta,Arthropoda,Both sexes,Internal,Pest,Lab,Lab-reared,Experimental,Terrestrial,NA,NA,NA,More than 5 days,Mix,No,Constant,No,Yes,No,No,No,No,1,NA,No,NA,NA,Fecundity,NA,Yes,NA,1,Yes,No,No,No,No,No,NA
Claire Smithson,Include,NA,TEMP1250,1103,21,21A,"Marchioro, C. A.; Foerster, L. A. m. a.",2012,Modelling reproduction of Plutella xylostella L. (Lepidoiptera: Plutellidae): climate change may modify pest incidence levels,10.1017/S0007485312000119,Plutella xylostella,Plutellidae,Insecta,Arthropoda,Both sexes,Internal,Pest,Lab,Lab-reared,Experimental,Terrestrial,NA,NA,NA,More than 5 days,Mix,No,Constant,No,Yes,No,No,No,No,1,NA,No,NA,NA,Egg number,NA,Yes,NA,1,Yes,No,No,No,No,No,NA
Claire Smithson,Include,NA,TEMP1255,1108,21,21A,"Marini, G.et al.",2020,Influence of Temperature on the Life-Cycle Dynamics of Aedes albopictus Population Established at Temperate Latitudes: A Laboratory Experiment,10.3390/insects11110808,Aedes albopictus,Culicidae,Insecta,Arthropoda,Both sexes,Internal,Other,Lab,Lab-reared,Experimental,Both,NA,NA,NA,More than 5 days,Mix,No,Constant,No,Yes,No,No,No,No,1,NA,No,NA,NA,Egg number,NA,Yes,NA,1,Yes,No,No,No,No,No,NA
Fay Frost,Include,NA,TEMP1258,1111,21,C,"Marshall, K. E.; Sinclair, B. J. m. m.",2010,Repeated stress exposure results in a survival-reproduction trade-off in Drosophila melanogaster,10.1098/rspb.2009.1807,Drosophila melanogaster,Drosophilidae,Insecta,Arthropoda,Females only,Internal,No,Lab,Lab-reared,Experimental,Terrestrial,NA,NA,NA,1 to 5 days,Adult,Yes,Both,No,Yes,No,No,No,No,1,NA,No,NA,NA,Offspring number,NA,Yes,NA,2,Yes,No,No,No,Yes,No,NA
Amber Chatten,Exclude,No sample size,TEMP126,198,2,19,"Azrag, A. G. A.et al.",2017,"Temperature-dependent models of development and survival of an insect pest of African tropical highlands, the coffee antestia bug Antestiopsis thunbergii (Hemiptera: Pentatomidae)",10.1016/j.jtherbio.2017.10.009,Antestiopsis thunbergii,Pentatomidae,Insecta,Arthropoda,Both sexes,Internal,Pest,Lab,Lab-reared,Experimental,Terrestrial,NA,NA,NA,More than 5 days,Mix,No,Constant,No,Yes,No,No,No,No,1,NA,No,NA,NA,Fecundity,NA,Yes,NA,1,Yes,No,No,No,No,No,NA
Claire Smithson,Exclude,No sample size,TEMP1260,1113,21,21A,"Marti, O. G.; Carpenter, J. E.",2008,REARING CACTOBLASTIS CACTORUM (LEPIDOPTERA: PYRALIDAE) ON A FACTITIOUS MERIDIC DIET AT DIFFERENT TEMPERATURES AND LARVAL DENSITIES,NA,Cactoblastis cactorum,Pyralidae,Insecta,Arthropoda,Both sexes,Internal,Mix,Lab,Lab-reared,Experimental,Terrestrial,NA,NA,NA,More than 5 days,Mix,No,Constant,No,Yes,No,No,No,No,1,NA,Larval density,NA,NA,Egg number,NA,Yes,NA,1,Yes,No,No,No,No,No,NA
Claire Smithson,Exclude,sample sizes not clear,TEMP1264,1117,21,21A,"Martinez, L. C.et al.",2014,Life History Traits and Damage Potential of an Invasive Pest Acharia fusca (Lepidoptera: Limacodidae) on Oil Palm,10.1603/AN13102,Acharia fusca,Limacodidae,Insecta,Arthropoda,Both sexes,Internal,Pest,Lab,Lab-reared,Experimental,Terrestrial,NA,NA,NA,More than 5 days,Adult,No,Constant,No,Yes,No,No,No,No,1,NA,No,NA,NA,Egg number,NA,Yes,NA,1,Yes,No,No,No,No,No,NA
Fay Frost,Include,NA,TEMP1267,1119,21,C,"Martinez-Jeronimo, F.; Ventura-Lopez, C.",2011,"Population dynamics of the tropical cladoceran Ceriodaphnia rigaudi Richard, 1894 (Crustacea: Anomopoda). Effect of food type and temperature",NA,Ceriodaphnia rigaudi,Daphniidae,Crustacea,Arthropoda,Parthenogenetic,Internal,No,Lab,Lab-reared,Experimental,Aquatic,NA,NA,NA,More than 5 days,Mix,No,Constant,No,Yes,No,No,No,No,1,NA,Food,NA,NA,"clutch size, total offspring number",NA,Yes,NA,2,Yes,Yes,No,No,No,No,NA
Jacintha Ellers,Include,NA,TEMP1275,1123,21,9B,"Matadha, D.et al.",2004,"Effect of temperature on development, fecundity, and life table parameters of Encarsia citrina Craw (Hymenoptera : Aphelinidae), a parasitoid of Euonymus scale, Unaspis euonymi (Comstock), and Quadraspidiotus perniciosus (Comstock) (Homoptera : Diaspididae)",10.1603/0046-225X-33.5.1185,Encarsia citrina,Aphelinidae,Insecta,Arthropoda,Unsure,Internal,Control agent,Lab,Lab-reared,Experimental,Terrestrial,NA,NA,NA,More than 5 days,Adult,No,Constant,No,Yes,No,No,No,No,1,NA,No,NA,NA,Egg number,NA,Yes,"pop growth rate (R0, r)",1,Yes,No,No,No,No,No,NA
Fay Frost,Exclude,Sperm viability included in other effect,TEMP1291,1135,21,NA,"McAfee, A.et al.",2020,Vulnerability of honey bee queens to heat-induced loss of fertility,10.1038/s41893-020-0493-x,Apis mellifera,Apidae,Insecta,Arthropoda,Both sexes,Internal,Other,Lab,Farm,Experimental,Terrestrial,NA,NA,NA,Less than 24 hours,mix,yes,constant,no,yes,no,no,no,no,1,no,no,sperm viability,NA,NA,NA,Yes,NA,NA,NA,NA,NA,NA,NA,NA,NA
Claire Smithson,Include,NA,TEMP1296,1140,21,21A,"McAvoy, T.; Kok, L. m. j.",1999,"Effects of temperature on eggs, fecundity, and adult longevity of Hylobius transversovittatus Goeze (Coleoptera : Curculionidae), a biological control agent of purple loosestrife",10.1006/bcon.1999.0720,Hylobius transversovittatus,Curculionidae,Insecta,Arthropoda,Both sexes,Internal,Control agent,Lab,Lab-reared,Experimental,Terrestrial,NA,NA,NA,More than 5 days,Adult,No,Constant,No,Yes,No,No,No,No,1,NA,No,NA,NA,"total egg number, daily egg number, hatching rate",NA,Yes,NA,1,Yes,No,No,No,No,No,NA
Abhishek,Exclude,no extractable data,TEMP13,4,T1,1A,"Acharya et al, 2013",2013,Life History Characteristics of Diorhabda Carinulata Under Various Temperatures,10.1603/EN11225,Diorhabda carinulata,Chrysomelidae,Insecta,Arthropoda,Both sexes,Internal,Control agent,Lab,Lab-reared,Experimental,Terrestrial,NA,NA,NA,More than 5 days,Mix,No,Both,No,Yes,No,No,No,No,1,NA,No,NA,NA,Egg number,NA,Yes,NA,1,Yes,No,No,No,No,No,NA
Abhishek,Exclude,No SD,TEMP130,13,T2,1C,"Bahar et al, 2018",2018,"Aster leafhopper survival and reproduction, and Aster yellows transmission under static and fluctuating temperatures, using ddPCR for phytoplasma quantification",10.1038/s41598-017-18437-0,Macrosteles quadrilineatus,Cicadellidae,Insecta,Arthropoda,Both sexes,Internal,Pest,Lab,Lab-reared,Experimental,Terrestrial,NA,NA,NA,More than 5 days,Mix,Yes,Both,No,Yes,No,No,No,No,1,NA,No,NA,NA,presence of egg and nymphs,NA,Yes,NA,2,Yes,No,No,No,Yes,No,NA
Fay Frost,Exclude,sample sizes not clear,TEMP1300,1144,21,C,"McCreesh, N.et al.",2014,Effect of water temperature and population density on the population dynamics of Schistosoma mansoni intermediate host snails,10.1186/s13071-014-0503-9,Biomphalaria sudanica,Planorbidae,Gastropoda,Mollusca,Hermaphrodite,Internal,No,Lab,Wild-caught,Experimental,Aquatic,Uganda,Africa,NA,More than 5 days,Adult,No,Constant,Yes (< 4 days),Yes,No,No,No,No,1,NA,Density,NA,NA,"egg number, clutch number",NA,Yes,NA,2,Yes,Yes,No,No,No,No,NA
